,user_id,business_id,text,date,compliment_count
202,o5ch055ATjfHgNFwgXbGcA,4RMHlggaIdNibPUJPVEd6w,Great watering hole!,2012-01-02 19:38:04,0
253,j7wiNAppjn1HEEqyP8OkqA,GlYN-RJyL_YwxIqsSDo1ag,Poblano potato ham cakes are the special this weekend,2012-01-15 15:53:11,0
272,jW1DJKo4DH9GsEYKFUHz3w,O_KX1Z4ZXMv0OVvQ9e8pNQ,Great flavors,2015-09-08 18:49:32,0
375,CzV4FlITtTjnq8dyiXiGkQ,boLOUdV5T1O5a1cWaClfDA,WAY too salty!,2016-01-27 01:38:14,0
428,I-wq3PJNBlaZ8tpi0SdS8A,frsWe9bmMOMIBOBNzsCTew,Come here for a late lunch and you can almost forget you're in the United States. Very little English being spoken.,2017-10-04 18:06:39,0
445,70p7ZC7JNkAn4YHJL2oLqQ,A0F-h3xJm_6gHDKcDQwSrQ,"Persimmon gelato - good,    mojito gelato - not so good.",2013-02-16 02:59:37,0
533,UnC8NYY-RRfh70cJVMSHzQ,oY5LFo6Yxxf32ePna6mEUQ,Spa messed up my body scrub appointment and offered later time. The later time did not work for me and they refunded the body scrub charge but still charged me the $20 day pass even though I had only used the facility for less than 30 minutes.,2013-12-27 19:22:12,0
559,ywIww7WHbmKRx8tNOk5i2g,iq0qAJ2Oc3myUTTMLseTXA,Very bland pizza. The large slice is more a gimmick and not practical.,2016-04-29 11:47:28,0
594,WqeE5e5ROfaVEgkb9dAkiQ,MTSW4McQd7CbVtyjqoe9mw,Love their pastries and drinks!,2017-09-20 17:00:27,0
705,JI6T6niNLWzks55uON1QDg,iBRXLFWD7PeSYDbKsd_JTw,They are out of frog legs :(,2015-09-05 22:49:07,0
875,xjLTK4saQ2Qe_6f9IxhVWg,cB5NEUkJOSIrjZR-agSltA,They are open on Sundays - 3 pm - 2 am,2013-02-24 23:53:09,0
925,w43g3Sr-udJVHilVgHlr7A,A0Jeadkkxq63uP2r27_6fw,"Once again, the clerk sees me come in, and doesn't get off her Blackberry. Made me wait about 30 seconds this time while she finished txting",2011-10-18 17:52:10,0
972,87X9z9-YFtX58mbQ2L1KPQ,NIQWO-Q_F598XlAvZnFVCA,"Truffle fries, corn dogs, or the riblets for starters! Can't go wrong with any of the beers either, but my favorite is Drakes 1500.",2013-12-12 20:09:09,0
1022,xjLTK4saQ2Qe_6f9IxhVWg,cB5NEUkJOSIrjZR-agSltA,Trivia at 7 on Thursdays!,2013-02-25 00:11:59,0
1027,ma6079CH58mAeIR8TBzElA,buhO8vRCaEoNvlxU0AJRpQ,Don't waste your time or money can't make anything right,2016-07-28 15:11:08,0
1070,dQDt0l5e9sre54eG7plUdA,y9yUyB9qldKaibuhJkC39w,"My healthy lunch spot I love the packaged Field Fresh chopped salad with chicken, Israeli couscous, currants,  asiago cheese,  and toasted pecans,  and sweet basil dressing for $3.99 can't be beat",2013-12-06 18:33:12,0
1102,Am_KAf9k8vXcmB8lvC8mWQ,7gyiQdr6MselGVlmbMkPMw,The vintage Tiffany earrings I've been eyeing for a year are still here...a sign from the jewelry Gods I'm sure,2011-01-12 20:50:58,0
1154,ECjfeIqrQj6e7VXVCTOleA,OrE8LhQpKVXTA6gJyu5G9Q,Costco card or AmEx Costco card really does get you 10% OFF! You can order to-go. Fast prep.,2015-03-07 22:07:40,0
1195,d90fhlNEmmkD91jpkXjjyQ,curw--Uj4rIWSRq69J_j8Q,Make sure you haven't shaved for at least two-three weeks if you're getting a Brazilian. I know it'll drive you crazy but it's so worth it!,2014-09-17 14:36:59,0
1301,j7wiNAppjn1HEEqyP8OkqA,GlYN-RJyL_YwxIqsSDo1ag,Breakfast special $1.99!,2012-03-20 14:43:37,0
1448,7JZvezE4QKPiHcmy1HSKDQ,SbdL-8NSmTWgSwdGZBa7WQ,"Good food, good people",2017-08-06 03:57:39,0
1511,t9rCx0ni7oabGhx2Bw-kZw,6Z89Ixagyc0mrVnyZHiIVw,The paella here was divine. All the seafood was succulent and rice cooked perfectly.,2013-06-01 22:48:45,0
1583,hj5Ja8M2vSTLgmcgzOW0Gg,ostgbmaf36hOicxyl71sPg,Delicious pizza AND great Italian dinners,2014-03-17 02:07:20,0
1601,XDHIa7cmHBL47XYcPPe5Rw,hLub5qdoU9w76O-k5pFiRg,Out of business - February 2015,2015-02-05 01:28:27,0
1628,zmlt7zUWY1Bi58_2n7UopQ,APW4-ESYGTIn17mY189Osg,Add some bread to your soup for $0.79,2014-03-20 15:48:16,0
1712,JQryB5y8Iy9BgkVADFIDTQ,yuW60QyweNNcyHa_3fkrYA,"OMG latkes, guys. Hearty, flavorful latkes. So happy.",2013-08-27 17:27:04,0
1845,Xw7ZjaGfr0WNVt6s_5KZfA,cB5NEUkJOSIrjZR-agSltA,"$2 draft on Tues, $3 anything on Weds",2013-05-30 02:30:32,0
1889,L4iT9ZCNxS2YxTzc2G5ucg,KabN4d4St6gxsVIA1KzS7A,Good gym but not a big space during peak hours so make sure you call ahead and ask what's the crowd like before making the drive...it's a good combination between Orange Theory Fitness and Anytime Fitness :),2015-09-03 21:58:57,1
1925,640-XJULtQ_P073RMClgPg,buhO8vRCaEoNvlxU0AJRpQ,Caffeine boost,2012-01-23 15:14:47,0
2045,q3jnFXllDl92i_acjMmAqg,QWqKTWQ2OiDgo3dzNkpung,Back again.,2012-06-13 19:47:17,0
2092,fih_HEOUORCXF-VWoZDIAA,S2Ho8yLxhKAa26pBAm6rxA,"Worst place to be, service undermine this city",2017-03-14 23:35:14,0
2157,P-Fv4Mm56a2wTEsA34JMew,dIpTuL2T1L98GQGU17IeSw,Wine down Wednesday: 1/2 price wine!,2012-05-31 01:17:21,0
2175,wKLYI27-HlYoI_KpyaLJjw,bN7KQSVbEmRVJnQEkl3vkw,Well here we go!,2013-08-25 01:41:48,0
2208,KYnMepSlQdna1DxF3Tj_hw,o2i4AvqF6Q9lWK-wksxzuw,So many gluten free options!,2015-05-24 18:12:18,0
2241,Xlb-Hxrvkfyadnkmk5hrgw,c6GTImF01z981_BNJIye2g,Ribs class!,2011-01-04 23:48:36,0
2332,rXFMeu6I9a9pcRyySGSQfA,kLG2-BOk3YHDXS8PCxekZA,A very classy place. Even the women feel free to belch openly here!,2012-05-26 03:53:45,0
2373,Wjia69bHEb7xeWMlxWNPGA,dIpTuL2T1L98GQGU17IeSw,Sneak into the back courtyard to hang out!,2013-03-14 21:16:26,0
2500,srRWZlj8-MtfdiR-oRwbFA,K8b2MQ5Az59-nzvqUfjJEQ,Fall salad...,2011-10-25 21:48:53,0
2501,7WTVHwpcgzsEe1ilu3ZCGw,5eldbLrF_oodWvu1VuEP8w,Complete false advertising on their new year's party. DON'T COME! No food (a 5 hour buffet was promised). The drinks are extremely weak! There are hundred of other New Year's parties around that are actually giving the customers what they paid for. Don't come here!,2017-01-01 04:09:47,0
2530,Am53OaJoKgw3NLrrQpDcng,Af2UlNzQSiZCapJ6qtwu6g,Best store in St. Louis - and elsewhere honestly. I've been shopping here for several years. Shop often - new treasures daily!,2011-10-06 18:19:36,0
2531,wLFuvZ59HGUJZ3QBgqlmAg,r43DrfYAbAgifsYyNkljZw,"Great music Thursday, Friday & Saturday nights. And never a cover.",2017-03-11 04:18:04,0
2666,u74KoKOshZobNmkb6L9PMw,0bPLkL0QhhPO5kt1_EXmNQ,Always a pleasant experience. The food is fresh and inexpensive. Great place to eat!,2017-07-15 00:51:19,0
2725,DWryovIM4VF2vim4p6WYaw,dIpTuL2T1L98GQGU17IeSw,Burrito was ok,2012-10-17 01:26:06,0
2740,1v9diJtvEnr6PH-1kOXUJA,2myVMP_l-9f9JIZewm19Cg,"Nice hotel, very pretty, clean and a good deal. The only thing is staff isn't very friendly.",2013-08-21 05:39:40,1
2834,xbfethSYuvFgHeW-gxqMyQ,zUJMvjK6aBeQtVCowZ85-w,The food was cold and tasteless.,2018-01-14 20:48:18,0
2836,35WgVGUNwj1z3VCgWTAabQ,QWqKTWQ2OiDgo3dzNkpung,"The food was ok but the service was horrible!!! I was eating n a guy was jerking in front if me n they didn't do anything, not even call the cops! The guy I was with talked to that guy the whole time n no one steped in to help us. Knowing we couldn't finish our food, they still made us pay. They didn't even say anything to us until we left. Horrible experience!!! Why would they leave a man sitting there for hours not even ordering food?? Not suspicious????",2013-03-12 14:08:39,0
2866,bi76Ih6tRv-ghYWFCJ0dag,aUbwGgYBX-kP4O3JgLCuXQ,Tara and Drew's Wedding!!,2010-11-20 23:01:47,0
2973,RVALk-GeKd504Ci-vGSTrw,Tm3QiAVLJAR2fEJK7APPPQ,My therapy! :-) debating on either soon the wefit class or Zumba.... Decisions decisions,2012-05-29 15:10:51,0
2974,6r_SqGghT3jGsiyt9t2IEg,GlYN-RJyL_YwxIqsSDo1ag,Trying something besides breakfast today! I'm sure I won't be disappointed!,2013-12-11 19:06:05,0
3041,acLOor4HFm1IuyEfT08ECw,E9-k8aOCS2sSh9RYxvWU_A,Food is consistently good,2015-08-30 23:18:43,0
3052,xXmtvRLU_Qpz0FT09mXGgQ,kLG2-BOk3YHDXS8PCxekZA,Dirty Martinis with Beth Inglish McMillian,2012-01-22 03:00:42,0
3150,pTL8bA87i3ttSa6QHoikLQ,JUlsvVAvZvGHWFfkKm0nlg,"BBQ & beer? Yes, please. Tex-mex, take me home!",2011-05-27 19:42:12,0
3254,q5BPCysNlI2_JZVq74qkDg,JUlsvVAvZvGHWFfkKm0nlg,"Come hungry , best Mexican Food in town. Best part bout this joint , ya don't get nightmarish mud butt.",2014-03-22 02:36:09,0
3328,-G7Zkl1wIWBBmD0KRy_sCw,zDJoyeohHjEX-Pz6zQfPng,Now the Stadium Bar & Grill.,2016-03-22 20:58:06,0
3329,axSG9jrGZPqL22l-MhVOpg,6GbuHdYPuN3jcSBmFplpXA,"Delicious and consistent, and they get Gluten Free!",2015-02-04 19:37:42,0
3345,lMY8NBPyzlPbbu-KBYfD9A,FMbU3h5FKs1PCNYiQCqBWw,Client waiting area revamp is to die for! Feels like home so I never mind waiting for service completion,2012-11-05 19:32:35,0
3354,mw1f4q4WrYNRM_2XfS8v6A,QWqKTWQ2OiDgo3dzNkpung,Nice clean good price it's right..a must go to restaurant being a date,2014-08-28 23:55:37,0
3477,TDeMStfIAQJxHILuNUqtyg,QkyEr9j7il9lJqseTbPe5w,Wednesday evenings they run a special. $70 two people- entire menu pick one app one meal one dessert each. Includes bottle of house Wine red or white,2016-02-16 01:43:46,0
3614,X1Vu977CKiiV6ZIoIUGtNA,JUlsvVAvZvGHWFfkKm0nlg,Shrimp tacos are good,2014-06-05 04:45:52,0
3644,AcGBRI0xZCuQ1Z85zFVLWw,kLG2-BOk3YHDXS8PCxekZA,How about a little tonic with this vodka? Holy cow!,2011-01-29 00:39:38,0
3699,ZgQR_6rLArNb7LK2hA8JMQ,0hCrds3sgFAYzsZolg3jcg,No Three Olives S'mores! Sad!,2012-06-21 16:17:59,0
3794,mASxmaixvYyV948AFa0Wjw,nIxepiPUk5FUfL4u9EFfew,Smells great! Off to a good start.,2013-11-30 00:35:43,0
3805,Mz6Gm2_5AYWJObnXXHXAqA,6Z89Ixagyc0mrVnyZHiIVw,Monfsy is Burger night!,2012-05-28 20:56:32,0
3867,tz4eV6-OWT6dl0ME_qWSdw,4RMHlggaIdNibPUJPVEd6w,"Samuel Smith's Organic Cider! Crisp. Refreshing. In a BIG friggin bottle! Oh - and we are listening to a good local band who works here called ""Big Terrible"" from their vinyl titled ""Rotten City"". It is really good!",2013-06-09 22:14:36,0
3878,z2YWzMyti5sjtAtnX15WoA,7hpUoYdAVToZXwuPRgoqdA,"There is overflow seating in the basement, but the couch by the fire is the best spot:)",2015-02-04 23:35:07,0
3909,3L38ANdK969R4QpRVoJqtw,J7Oo9rhwX7O3ak54pu_Mhg,"Meh.  Nice people, but needs to be degreased well.",2012-06-05 16:59:04,0
4195,g3cYRU_hNKMOlB-gcrlGjQ,6Z89Ixagyc0mrVnyZHiIVw,Easy reservations and the best staff!!,2013-06-09 23:44:02,0
4202,CRSpG1N7yBisr0hMk2IZJQ,JEHLdDbFMS1tEMSgaKfJxA,"Food was acceptable but Will our server made the difference. If you want a great dinner and service ask for him. Thank you very much Will, we will be requesting your section even if there are no booths",2012-08-06 00:10:02,0
4315,0kUI7LAvbx6V8oDz2vgn-g,G_gkdBVK8N5Sp9CSGnYeMw,Best corned beef in Indy!,2011-04-06 22:34:43,0
4417,IfmqDWAJWj1tapg73wFtfA,ZCURd9PiH4qdEjQfrIZzFg,My Friend and I was at Maggie's in Santa Barbara. Food was awful Italian waiter was great. Owner treated my friend very bad it became very apparent the Owner was a racist and her rude treatment to my friend was because she was Black. The owner argued with my friend and asked us to leave.  The Owner would not allow any waiter to wait on our table.  I would not recommend this resturaunt to anyone especially if you are BLACK,2013-06-02 22:31:08,0
4495,ekFb_YClMcH0BMPfO21RGQ,c6GTImF01z981_BNJIye2g,Awesome class - great food :-),2013-11-26 02:11:35,0
4518,X1Vu977CKiiV6ZIoIUGtNA,JUlsvVAvZvGHWFfkKm0nlg,My place,2014-04-21 04:12:57,0
4566,jHvY4LCZrqQwG4UPJolJ3Q,dIpTuL2T1L98GQGU17IeSw,Great food and beer!,2011-08-07 01:58:31,0
4573,qv0Jthy-A0D95FDDIUapmg,o2i4AvqF6Q9lWK-wksxzuw,Really good fish tacos.  Surprise.,2013-05-24 18:25:40,0
4652,4PdVLzc1e5zjq2zwVysPPQ,o2i4AvqF6Q9lWK-wksxzuw,"Decent happy hour.

I take it back.  Nothing special here unless you go for the oysters.  They once served me deep fried carrots instead of vegetable tempura.",2011-07-22 02:46:46,0
4658,j-rhaPEBYWLRNGIYJ_K5lA,6Z89Ixagyc0mrVnyZHiIVw,Burger night.  Banana bread,2010-02-15 02:40:32,0
4744,NSPIUrurGiNPQnMJnXc5fg,c6GTImF01z981_BNJIye2g,Eggfest! Come see us at the Sun King beer truck!,2011-05-14 15:21:11,0
4769,y3nInWaBptG5kPLVQY_MRg,7IdIGemGZodDAA_9mJCigA,Best onion rings and coffee milk shake ever,2016-05-11 21:17:31,0
4774,X1Vu977CKiiV6ZIoIUGtNA,JUlsvVAvZvGHWFfkKm0nlg,Late nite happy hour,2014-04-08 03:36:25,0
4786,0t13G5VJ3BWkRVXa4JAq9w,zDJoyeohHjEX-Pz6zQfPng,Raw. Bar for sure,2013-05-31 23:45:14,0
4789,mLMTOW3bWc2BMSdYL_DS3Q,JUlsvVAvZvGHWFfkKm0nlg,Fast service and $10.00 pitcher of margaritas,2013-02-22 00:35:06,0
4799,ZkhW_TcIk2grGaLbC6eWBw,c8rjE6NcfeyzLB_aU1GdMA,What a joke. What Philadelphia bar won't put the Flyers game on? You guys SUCK,2015-03-07 19:09:54,0
4908,oSjxHFZjcuY_PX07a9Fm2w,Y6yKULVTDX4Asp3BaL5ScQ,"Starting  in February 2016, only one storytime at 10:15am (instead of two less-attended ones).  Fun and busy, full of music music music.",2016-02-04 18:32:17,0
4946,X1Vu977CKiiV6ZIoIUGtNA,JUlsvVAvZvGHWFfkKm0nlg,Great place to be,2014-06-14 01:01:23,0
4964,hZ-ZtZ3bqZg6GhWepqj20g,UM6XgOtTX4DWWcGDTWtjEg,I.love.this.bar.,2011-10-11 22:20:58,0
5079,AQ_rpad7JQREara5O8sitQ,NIQWO-Q_F598XlAvZnFVCA,"If you have a yelp ""free appetizer"" check-in deal it's not valid anymore!! =(",2015-05-18 18:47:25,0
5112,goySBsZ3QJfSaElPIDIzLw,A0F-h3xJm_6gHDKcDQwSrQ,Kitchen closes at NINE p.m.,2012-03-20 02:19:08,0
5154,-X1DtcndHvtoFkVsZZLsFg,Aphp-EdFass877c-sWp5eg,"Must try main track crepe, although I subbed provolone for the feta cheese. Dollyfloppers (beignets) are awesome!",2012-10-20 18:23:58,0
5255,acLOor4HFm1IuyEfT08ECw,E9-k8aOCS2sSh9RYxvWU_A,Food is always consistent. Santa fe blackened chicken wrap awesome,2015-09-13 22:57:46,0
5350,PrJ37Ik9DxritxGPqI9ktw,H2nFgEFitRk7ltE8IRH0xA,my first time at this Taco Bell i must say it was very clean unlike the many Taco Bell have seen. fast service too,2011-07-12 17:28:55,0
5458,u3cttqqjTzrQJV8ziE9aUw,E-nhxuu3zbt02oCj_1AFng,So many awesome choices for you to feel amazing :),2016-05-21 19:29:55,0
5465,aX2EbnZtMjxvNLgcsQtjPw,E9-k8aOCS2sSh9RYxvWU_A,Burger and a cold beer without the crowd? This is your spot.,2015-09-28 21:25:33,0
5550,KZeevXlrB1LDgjgsPwVS2w,hF-Ndu77yzspMkDZv9bWzg,So good!!,2016-02-03 17:17:33,0
5611,RMjEYnvC-fhu8RoopYj2Ig,QWqKTWQ2OiDgo3dzNkpung,Busy today- parking lot is full!,2012-01-08 17:08:46,0
5632,iPx3j4gauS-oVogXTiUGxg,r43DrfYAbAgifsYyNkljZw,"The bartender will never ask you if you want to order food, and will not check on you unless you're done with your drink (IF then).",2016-07-28 22:46:17,0
5653,iIAxuzekoFKUkdrqIflKtw,NIQWO-Q_F598XlAvZnFVCA,"For those of you who like to add hot sauce to everything, they have an amazing sauce they put on their wings and it is awesome on burgers/fries.",2013-02-10 18:45:17,0
5757,dQDt0l5e9sre54eG7plUdA,MTSW4McQd7CbVtyjqoe9mw,Really good egg tart and bubble tea.  Best we have had in Chinatown so far,2013-06-17 17:28:26,0
5788,jHvY4LCZrqQwG4UPJolJ3Q,4vLJd8N3wy_Q_wu_DZuRag,Try the Soho BLT!,2011-08-07 16:51:03,0
5856,Xlb-Hxrvkfyadnkmk5hrgw,c6GTImF01z981_BNJIye2g,"""If you want your husband to cook more by him an Egg!"" - KEW",2010-12-02 23:02:23,0
5883,HvO4EP21-9Ty75slfATM9A,2kOGFDJ9v4T9AzuKWhwl2g,Drive thru!!,2011-08-13 17:00:08,0
5910,G-l9ihg3sRAiGTuZLDmJTQ,OrE8LhQpKVXTA6gJyu5G9Q,Have a Costco card? Save 10%.,2014-06-03 02:06:39,0
5933,hs9HYNgFw_aKlmv4E6X4HA,cN4Y09a7clgjFd1tY-wSZw,The new filet tacos are so good!,2011-08-06 20:33:03,0
5945,5bJpDx4c7x9fYzdltOhfbw,7hpUoYdAVToZXwuPRgoqdA,Perfect spot for a meeting!,2014-06-27 19:16:37,0
5987,uCAtWdcGvNDkJUxqBk8OBA,oY5LFo6Yxxf32ePna6mEUQ,Best massage ever!!,2011-03-07 21:01:39,0
6092,vez7OWVZo98_Yqg77XJC-g,NIQWO-Q_F598XlAvZnFVCA,Great IPA sampler on a sunny Santa Barbara 'winter' afternoon.,2016-02-03 21:31:49,0
6142,rk9ZXI0OjdelPKDG1kl_gg,2kOGFDJ9v4T9AzuKWhwl2g,The employees are deep-cleaning today.  I love to see this!,2017-03-25 18:13:01,0
6176,KOwIr6XJIErjlpD3i54MwA,dIpTuL2T1L98GQGU17IeSw,Salsa's incredibly fresh and your check gets you 10% off next door @SPoT,2011-04-26 04:49:10,0
6506,1cfl2GIaTDJ_uiiIC_kUvQ,QWqKTWQ2OiDgo3dzNkpung,"It's very nice  

They have a shortage of forks though...",2016-01-14 05:33:46,0
6796,zbmWrzRDq82QPKzveYV-cQ,hDVpw1PSS31uFUCOsI-eog,"This place is a joke, more like taco crapday",2015-02-25 03:13:24,0
6819,X1nvKXUJ5Lp3W9Oe-_JrMQ,c8rjE6NcfeyzLB_aU1GdMA,"The service here is always pretty poor but if you hit a happy hour, you can't go wrong.",2011-04-16 12:39:55,0
6830,z7Fd9GM8_fESYUSFSKCvGQ,QWqKTWQ2OiDgo3dzNkpung,"Tri-lingual menu - English, Korean and Chinese",2016-09-03 03:54:51,0
6908,y3nInWaBptG5kPLVQY_MRg,7IdIGemGZodDAA_9mJCigA,Best Key Lime pie and green star coffee and fried chicken,2016-02-12 21:16:27,0
6952,B0422GXKvTehyp0PCiogfg,S2Ho8yLxhKAa26pBAm6rxA,Great etouffee. The waiter was very friendly. The restaurant was very clean.,2017-06-11 15:22:11,0
7036,64XUYBF1Rpe8ax7M2w9oYQ,kMHZgooGdHN9099Ya0X4vA,Room was filthy and had bedbugs (unfortunately did not figure this out until later). I should have followed my instincts and not stayed here. Stay away!,2017-10-04 03:43:17,0
7049,pSgXrtF35AYfCoZcvIExLQ,N3m24XDVz7YSI8f39LELTQ,Awesome barber!!! $12.00 cuts cash only.,2015-06-05 23:01:40,0
7158,FlXBpK_YZxLo27jcMdII1w,4gn3wNWbNK8vPfoCN_BKAA,Extremely ignorant employees.,2017-08-29 01:47:26,0
7171,8WzFNiQZbUJjvHoT2Jp5rg,z7sp6u5JnNlq2ziu31EFvw,24 hour pharmacy!,2010-03-11 01:15:15,0
7180,m6SZs9-UPweT1LpmUftIZA,4iTsgayXGV8zYppognuQXg,It's a good burger place with great fries!,2015-06-23 15:58:54,0
7198,tQ6HM9ldSsYbuPugPUr-gw,z7sp6u5JnNlq2ziu31EFvw,Go to another drugstore and make sure it's local these big stores run out in 2 hours or say we don't carry that anymore lol I guess yesterday was the last day and tomorrow you carry it again,2013-02-22 23:46:10,0
7217,83RL7Mpq6nh8dGCpBTIKnw,JUlsvVAvZvGHWFfkKm0nlg,Im here now... And its not good.,2015-09-12 01:16:20,0
7362,saQQmDQQJ14BVkm_sg53UA,APW4-ESYGTIn17mY189Osg,Chicken pecan salad is great!,2012-12-03 16:58:02,0
7369,lSJAz1la2MngxNqSFSmUsQ,nIxepiPUk5FUfL4u9EFfew,The BBQ buffet lunch is outstanding.,2012-11-15 21:00:11,0
7379,T4luqLHT6waoNp4BgKJRXA,OrE8LhQpKVXTA6gJyu5G9Q,Good bowl of pho.,2015-03-02 19:40:44,0
7385,9n7RwTPN_yjSBypKt5Ipww,boLOUdV5T1O5a1cWaClfDA,"They have an interesting ""Taste of Newfoundland"" grocery. Very cool!",2015-06-02 01:15:38,0
7487,jeiDSBx1cc7uxi7kX9OI6Q,OrE8LhQpKVXTA6gJyu5G9Q,Phooooo!!!!,2011-08-08 22:19:59,0
7502,W625SoCsKsZyiws3GR1MTg,UYxGgnJ4Z2lOehK23HSIlw,Now called Mister Car Wash,2011-10-07 16:21:16,0
7506,njcXFGqIuSp-_joP42MhxA,6Ua4Pu_2bXuxpaxDyUA_BQ,"JLa, CiRo, Sidster, Galafanakis, and D-Dawg! And, the CC Music Factory...!!",2012-05-27 03:05:54,0
7577,D8vGFpjgrugOgbJ8custEg,lNsnmur2Df2oK9ywyY0H3g,Everything I've had so far is good. The tortilla soup was amazing!,2012-05-22 17:03:13,0
7614,rY3YK7bzZGxzaKB_iNN1tQ,lNsnmur2Df2oK9ywyY0H3g,Great place.  Food delicious service very good.  Best ceviche in the area.,2018-04-28 00:30:54,0
7663,pTIS74bisEX8Na9NVYC17Q,bPPy7yNFfb-6N_bHkn1qAw,Had this at lunch. Great spicy stuff. Will be back.,2013-10-27 09:35:54,0
7675,TeRRWmSTokpfPV-FxhnwOg,o2i4AvqF6Q9lWK-wksxzuw,This place is horrible that's all.,2016-12-03 22:38:29,0
7686,iqVVmm1vcI7Hn1PUE2t_XQ,lV0k3BnslFRkuWD_kbKd0Q,"Dessert is offered, but it's not on the menu. Walk in and check the chalkboard to see what they have.",2017-07-02 20:38:57,0
7688,acLOor4HFm1IuyEfT08ECw,E9-k8aOCS2sSh9RYxvWU_A,Try the onion pedals .. Good app.,2015-02-23 01:14:00,0
7699,7Na1pUcEv3oF_QTRwZ-2iw,NIQWO-Q_F598XlAvZnFVCA,"Kelsey is friendly 
and nice",2012-11-18 05:36:41,0
7761,WtsRDbbAF1X6LQX1qpIjOg,S2Ho8yLxhKAa26pBAm6rxA,Great wait staff! Great food!,2017-07-01 15:00:02,0
7764,RKULSOrIvvYpDmtuYXEXzA,nMxfEiAANa_FsrCZZVHoEg,Only us die hards willing to brave 15 degree weather are here,2014-01-24 02:26:12,0
7895,jp8o3v_8qnuqBjnM50r_Ug,4FjJEFN8CK6eoLMmt7t9EQ,24 hr,2011-04-14 01:01:26,0
8039,7Ju_RQfW5vEo1ExxauUQMg,2kOGFDJ9v4T9AzuKWhwl2g,Mochasippi. Yes.,2012-04-01 23:28:32,0
8099,aZpUMXB8ybm1CO1WGbt6uw,cN4Y09a7clgjFd1tY-wSZw,Stop in for a beverage or two!,2013-12-28 20:47:34,0
8107,-B-QEUESGWHPE_889WJaeg,NIQWO-Q_F598XlAvZnFVCA,"Happy Hour, DAILY but only 2-6",2012-10-06 20:05:04,0
8145,I2XpWCHAom1JRyHXZQrnfg,6Z89Ixagyc0mrVnyZHiIVw,"Yeaterday afternoon, when the place was very quiet, what a calamity. If I had seen the restroom before I ate, I would not have stayed to eat. NO EXCUSES, staff standing around out front, needing things to do, 2 hostesses with 3 tables of customers......",2015-10-19 15:12:59,0
8212,ibRrf8Kv4Oo-pUsAH9wtjw,HsibLfc2XD7Gh7Hbd1WfJQ,Limited hours for the staff. Make sure to call ahead if you want to sign up.,2013-05-16 10:32:31,0
8235,T6TInNEhz-qm5tT_ZjQEoA,JUlsvVAvZvGHWFfkKm0nlg,Steak Enchiladas=duhlicious,2011-08-16 03:27:56,0
8248,dEvFqqQImRAaE1dT5wYMJg,GMjmrbksSxabPHYmhjsOEw,Sean S is an outstanding guy to talk to about anything gun related.,2017-10-20 22:34:03,0
8275,LCcd6tEjC_Ty-aCVBHJjcw,US2-dEVvnOdde7Syi18TTw,Check out the drive through option for meals to go.,2017-10-12 17:09:33,0
8403,_Wkf2RNDnBuqMOpzSqmZXw,fNfnyVFfn7B9zuU7cYyk3Q,Open seating so come early.,2014-06-14 02:28:23,0
8422,QEpNF4Hag6_W9Stc-1Frvg,-Tnsc_b8dsWuAq1wQugKZA,Free Taco when you purchase a drink on Fridays,2013-02-23 00:19:38,0
8445,AUIfv9YC3RW8GvC516qM3Q,GlYN-RJyL_YwxIqsSDo1ag,Closed as of 1.4.18,2018-01-04 18:45:51,0
8585,acLOor4HFm1IuyEfT08ECw,E9-k8aOCS2sSh9RYxvWU_A,Try the fish taco,2014-11-02 23:54:23,0
8800,JMtTO8a2ji_D4j3McSiJsA,UM6XgOtTX4DWWcGDTWtjEg,"It's their 1 year b-day. Live music, balloon drop. Tostadas and drinks on special!",2011-09-02 01:52:52,0
8850,RIXIoCTafjr1auUJkV3fLg,GlYN-RJyL_YwxIqsSDo1ag,They have a awesome menu and plenty of parking.,2014-06-29 18:00:29,0
8911,y3nInWaBptG5kPLVQY_MRg,7IdIGemGZodDAA_9mJCigA,"Best fried chicken and coffee
And key lime pie",2016-02-12 21:13:18,0
8945,5O3VvfDu_HDvgUviAqmTEA,0hCrds3sgFAYzsZolg3jcg,Restocking our wine cabinet.,2012-05-19 21:32:24,0
8982,W625SoCsKsZyiws3GR1MTg,buhO8vRCaEoNvlxU0AJRpQ,I love watching the guy with the beard. He really moves the line. Lots faster than some Starbucks (I'm looking at you Intl Mall),2011-07-25 14:51:17,0
9200,LWAd8A8mu1V6WlR3CEzN8w,QWqKTWQ2OiDgo3dzNkpung,Nicely decor place and good food. Own parking lot!,2013-09-01 18:05:56,0
9238,EuHciNKJWb5UfJdlD78fBQ,0yElmJZHbfRJt4gmdot8Og,"A very a long wait, each and every time.",2015-06-08 00:59:18,0
9265,th53Z_6W9q4srq8HyOSVqQ,dIpTuL2T1L98GQGU17IeSw,Awesome sandwiches and friendly service. Highly recommend the grilled cheese proper!,2014-03-16 16:34:32,0
9280,5Y5KbsI5buMcNh2hTFaRpA,hk4987MH7je8PtGs-acesw,Setting up for the FREE Nashville Symphony show tonight! Stop by and say hi to Samantha at the Yelp booth.,2011-06-09 23:24:34,0
9322,OAZEpQPipvmHpzKdNlpa3A,NIQWO-Q_F598XlAvZnFVCA,Not great service. Here for an hour and no table!,2015-06-17 04:23:31,0
9343,wKLYI27-HlYoI_KpyaLJjw,bN7KQSVbEmRVJnQEkl3vkw,"And know am the Duke, of wings... I will take my rightful 
Spot.",2013-10-15 00:28:02,0
9381,OINYv6r1OMFK9wbDpno9AQ,piLUryfru20TQEafOj4QRA,If you sign up for a foundation class might want to make them aware you register so there prepared to teach the class.,2013-07-18 22:43:14,0
9409,xfkwKJdPZ2Sp6OgoHEB-AQ,JUlsvVAvZvGHWFfkKm0nlg,Veggie wings!!',2011-08-13 02:10:02,0
9462,3pQalTKpgnQ_EalVcyCSMQ,boLOUdV5T1O5a1cWaClfDA,Doesn't Accept AmEx,2014-04-04 01:38:51,0
9477,pzikC7tVCIcGSX9XkyKmDw,4gn3wNWbNK8vPfoCN_BKAA,Quality is definitely declining at this joint!,2013-09-16 23:00:09,0
9509,iiu3bqTQyXy2Eu-jzO0T2Q,JUlsvVAvZvGHWFfkKm0nlg,Forgot what day it was because of the holiday so we missed the breakfast specials but the wings turned out to be an awesome second bet.,2010-05-31 17:29:56,0
9686,hkWF1qtvcrg-ha4BCdNX1Q,QWqKTWQ2OiDgo3dzNkpung,This place is legit on the soft tofu. My husband gets the galbi. Delicious.,2016-05-21 06:45:36,0
9982,lqKdWZ8UbNXQYSdbEP-m7A,HsibLfc2XD7Gh7Hbd1WfJQ,Apparently Sundays are busy days ): womp,2014-03-23 22:06:52,0
10006,RMrWegRjr3gn_g7fOLxHRA,JUlsvVAvZvGHWFfkKm0nlg,get the veggie buffalo wings with the wing sauce on the side so the wings don't get mushy. delicious!,2010-06-17 19:10:46,0
10176,8TRA3xDJco8Pg0g3U1FxoQ,dIpTuL2T1L98GQGU17IeSw,Heloooo Cigar City Maduro Brown Ale..........tampa beer pretty tasty,2011-05-19 23:42:57,0
10305,YWqgaqWNWLQXPzGR5c5j1w,JUlsvVAvZvGHWFfkKm0nlg,Outside seating is great when the weather is nice.  Dogs allowed.,2011-02-25 02:08:13,0
10315,kwS4Orph3IzrOPoxs080dw,CZ2KPQtt0ah0up00YK0Ypg,Shopping center is hard to see. We passed it twice. So worth it!,2011-08-04 23:30:52,0
10330,zBK4V9bLPPGSRe-kbtlc4w,NIQWO-Q_F598XlAvZnFVCA,Open early at 10 am for Football season!,2015-09-13 18:50:15,0
10334,eqI5C_dFwwcrUgB6q6Z6xQ,kLG2-BOk3YHDXS8PCxekZA,Bad day door guy???,2013-06-04 09:08:18,0
10342,2DJS5aDboS3JP116ox_5aw,NQ01WqVX0tojNHKn-0sFww,Best place for rugby.,2014-03-15 17:47:27,0
10391,c87zSGqkAh_HhGM7nR13vg,4gn3wNWbNK8vPfoCN_BKAA,Wife ordered online menu wasn't done. They did not even appologize. This was just 30 min ago. Chipotle here I come.,2012-04-17 21:26:26,0
10398,NB_WSADikDslVK-u40XShw,4vLJd8N3wy_Q_wu_DZuRag,Best bagels EVER!!!,2012-10-13 14:01:40,1
10409,8M4_nA8e9VacrirvCwrl8Q,OrE8LhQpKVXTA6gJyu5G9Q,Spring rolls use iceberg lettuce -- yuck,2011-07-14 22:29:15,0
10439,AshBB8EMCttPOObB3ez6SQ,-fMwcA1pFUUv3RCsehpnwQ,Did you try one of their signature cocktails? Hope you didn't miss out!,2015-02-08 06:21:55,0
10510,7SgM5DrVSfkaqCpyeKjT0g,JUlsvVAvZvGHWFfkKm0nlg,If you don't mind the calories the chicken and biscuits are the way to go!,2014-06-29 19:23:30,0
10599,Tcjhv3NnsT4QrxWTMLulbg,hYonVJe6xzVBHHT2FLo4zg,The pizza and motz cheese sticks are the bomb.  Good beer selection as well.,2015-08-30 21:46:34,0
10655,eDNNJAK3SKKrFoMyyEmJmA,hYonVJe6xzVBHHT2FLo4zg,Pizza tastes like frozen pizza. I've actually had frozen pizza that's better.,2016-08-04 23:59:47,0
10674,3EWotVSF_JaK-SBEnwuBSQ,lNsnmur2Df2oK9ywyY0H3g,With my daughter always a wonderful night. Great food,2012-08-03 01:19:18,0
10713,PTyfmCzxo47RdfOjJVXFmQ,QWqKTWQ2OiDgo3dzNkpung,The spicier the better :),2013-05-21 19:32:14,0
10728,Z_vjP0DVaHl8rAFd7vweFw,QWqKTWQ2OiDgo3dzNkpung,Awesome tofu soup. One of the best I've ever eaten.,2015-02-15 18:59:13,0
10774,Zd8obfhbaGin0jhVdDPctw,JUlsvVAvZvGHWFfkKm0nlg,Brunch was delicious. So we're the drinks.,2017-09-13 15:26:50,0
10794,MB7oPXarFHoEmk2gG0Zonw,eaVcAlPmz-3C2ICy4zqbfw,1 hr and 20 minute wait!  For a haircut.  Unbelievable,2014-03-18 21:15:33,0
