,user_id,business_id,text,date,compliment_count
105380,wKLYI27-HlYoI_KpyaLJjw,bN7KQSVbEmRVJnQEkl3vkw,"20 wings and fries, the best.",2012-10-02 02:09:35,0
105387,tQ6HM9ldSsYbuPugPUr-gw,l_u2KGYWvx2LBcRV1G-wyA,I can't complain I saw him like 5 times no issues.,2013-04-29 16:12:23,0
105458,EYDmZ4e8b_zu-zfe7eiQBA,rBE5TT_ndOOczNBrbRnJwA,The service the food the sangria- all amazing. It's a Sunday afternoon tradition!!!,2015-04-27 02:42:01,0
105621,q8UCuDgdaek2efLir3uSQw,4iTsgayXGV8zYppognuQXg,"Preorder even if it's just for one burger. It's lunch time, I would expect a rush and prepare a paddy or two. I know it's freshly made but there are 0 people here and this has become a 10 minute process to cook 1 burger. Maybe I just need to continue to practice patience & deep breaths",2014-03-05 17:29:36,0
105638,_ufG-6QfPQyOg8wrH-6e2Q,WtUxi5n8KlQdfgHZfB2Fqw,Get take-out since you probably won't get a table.,2016-09-10 07:07:12,0
105646,sraTrYU-7q_bQ0TxQrLJvQ,0hCrds3sgFAYzsZolg3jcg,The Next big events here are Aug 20th and Sept 2nd! :),2016-08-14 18:06:53,0
105868,hla_Au4fcGMHU8PTFd05nA,GlYN-RJyL_YwxIqsSDo1ag,"Fathers day breakfast, busy!!!!",2011-06-19 18:25:10,0
105892,EaTxfdZ1nlJaGdLUY_8c2g,kex3ujGWOUvBX_ms4Etdtw,Great sandwiches and quick service,2014-05-26 03:40:36,0
105948,8qjXv8tAjdlM6gh0T1Wybw,JUlsvVAvZvGHWFfkKm0nlg,This place has the gaul to charge $1 per person for endless chips and salsa.,2014-07-06 18:29:10,0
105964,9El93RIslfaBjusDZLpE5A,SbdL-8NSmTWgSwdGZBa7WQ,Love the Bodacious BBQ pizza with meatballs!!!,2015-04-20 16:09:01,0
105977,Lw1PMvZE_cH9oYdpPJpNpw,GMjmrbksSxabPHYmhjsOEw,Don't go here if you value any level of respect or customer service.,2014-12-21 21:34:07,0
106021,2vNe2wRdNurtc67qyuwL9Q,J_K_rgs3xZJkd3zAX1JxMw,"Dude, they give whole pickles for $1...I'm sold, love it!",2010-11-09 18:42:31,0
106045,RWabrLghnYYIe75Yh-3hLg,TAMljxfGPkHShOReNy2tPA,"Good paint work, cheap price but very good quality,",2021-06-01 06:53:13,0
106053,nR91y6KbMbaKEix8_8BoyA,H2nFgEFitRk7ltE8IRH0xA,"This place is very busy during lunch so if you only have 30mins to spare, if suggest making other plans because it'll prob take longer than that to order, get, and eat your food.",2014-10-03 18:27:19,0
106057,2Qh2yB2hNJpDUM2-QLbsaA,dIpTuL2T1L98GQGU17IeSw,Robust flavors and specracular service!,2016-06-29 00:20:14,0
106117,Jm3r5SRnAUYkl-KotPv23Q,MuJBELBk9VXJjH0tryDh1w,Jessica was amazing as was the food:) Incredible!!!,2017-12-10 01:07:02,0
106177,trv2a6m_O8_83ay2-CgoEQ,7hpUoYdAVToZXwuPRgoqdA,Try the hot chocolate to experience Nirvana.,2013-01-21 16:51:46,0
106442,nR91y6KbMbaKEix8_8BoyA,rBE5TT_ndOOczNBrbRnJwA,They have great hummus and  babaganoush! Very fresh tasting.,2015-09-16 00:37:54,0
106608,hZ-ZtZ3bqZg6GhWepqj20g,UM6XgOtTX4DWWcGDTWtjEg,Tenacious Trivia = all kinds of awesomess.,2012-05-04 00:12:04,0
106609,YZMpS1YdyD3rmtH78u2pFg,JUlsvVAvZvGHWFfkKm0nlg,Off to a fantastic start at this very fun mexican.,2012-02-25 18:20:16,0
106694,BqZ6A43kKVTqe7pLODohpw,S2Ho8yLxhKAa26pBAm6rxA,O. M. G. Hands down the best food we had in all of New Orleans.,2018-08-22 22:55:46,0
106709,MUBoVv-Z50T4FwhZKc-z8w,0bPLkL0QhhPO5kt1_EXmNQ,".......
...
...............
..",2016-08-22 15:21:36,0
106827,ik0UUieUX38rPg24heeVgw,NIQWO-Q_F598XlAvZnFVCA,Hoppy poppy on tap for $3 (special for the day/week),2013-05-13 04:41:21,0
106836,zmlt7zUWY1Bi58_2n7UopQ,APW4-ESYGTIn17mY189Osg,"I came in a bit under the weather and with my crutches, and a kind lady by the name of Pat from Mary Lee's House paid for my dinner.  That made my day! So I decided that maybe I could make someone happy as well, I left $9 for the next person who orders.  When was the last time you made a stranger smile?",2014-03-03 22:25:11,1
106850,YfksVGG6IqPM26cF2Tje2g,fNfnyVFfn7B9zuU7cYyk3Q,Park at Silver Peak. Bruka will validate your ticket and it will only cost you $1 to park.,2015-04-17 02:46:09,0
106909,LM1Aleq_ozhEslRd2GUGEQ,NIQWO-Q_F598XlAvZnFVCA,Best Brussel sprouts in Santa Barbara,2019-04-13 03:04:24,0
106937,Ohl_ZGDvH2zNMaDfpd-D0Q,UM6XgOtTX4DWWcGDTWtjEg,Because they have schlafly pilsner tee hee!,2010-10-27 04:06:21,0
107004,vFZUDAxiFZlEQgkV3VSsBA,5ajlNT55iwhG0nID6ijUdA,Small but ok,2016-03-13 02:04:11,0
107071,97BHRNfBqubPqisKmj46Ww,_E0WPHfJEYmwOUCAj-Jq1A,"this place makes me wish i lived in sparks...well not really but appreciative of peppermills' sister.  i drank, smoked, gamed, cheered, jeered, abused and ate & slept w/her.  thanks for the fun weekend...see ya again!",2013-09-22 19:04:33,0
107114,VG-toQE2YcjDlmgvLni2ew,_E0WPHfJEYmwOUCAj-Jq1A,"Cool ""locals"" casino. Owned by Peppermill. Rather stingy comps system, however. I dropped around $300 there on tables & slots, earning 1 lousy comp. pt. Challenging parking siutation, even when they're not that busy.",2019-07-30 00:21:11,0
107162,wKLYI27-HlYoI_KpyaLJjw,bN7KQSVbEmRVJnQEkl3vkw,It is done!,2013-10-15 00:28:46,0
107191,RAa50KyI6qavYXW1hEe50g,6Z89Ixagyc0mrVnyZHiIVw,I been going to catch 23 for eight years the best hands down burger night on Monday for the price great. Awesome steaks this is wonderful atmosphere good service top-notch restaurant  Make sure to check this restaurant out it's a treat and you will be truly impressed,2013-02-09 00:21:04,0
107206,c4gjYdd3u8vc8eE63xyCpA,4vLJd8N3wy_Q_wu_DZuRag,They also do catering.,2019-01-24 05:19:22,0
107219,e2eTw3p0f1IBj9IL1TZc5A,pJB63RaQpkTIKBhfTsLQQg,Great Indian food!  Perfect spice levels. Definitely get the biryanis.,2021-05-29 15:15:41,0
107230,nR91y6KbMbaKEix8_8BoyA,APW4-ESYGTIn17mY189Osg,Call ahead if you are in your lunch break... It takes about 15 mins to get your food.,2014-12-10 18:42:44,0
107264,ljlqohoODQqZl4G21Adpgg,NQ01WqVX0tojNHKn-0sFww,M. K,2018-07-02 16:58:20,0
107348,FUUEU3ZN5cL1nNNR2AYZuw,TQloD2_k3J67Q1J_picgfw,Free air for tires means a trip across town to get here. Worth it!,2013-05-07 13:27:33,0
107363,LM1Aleq_ozhEslRd2GUGEQ,NIQWO-Q_F598XlAvZnFVCA,Service is iffy at times. May have to ask for things a couple times,2018-12-30 23:09:13,0
107387,KcyF9wl6v5Nk2VAp8xSePg,dIpTuL2T1L98GQGU17IeSw,One of my favorite bars in town. Great for a light meal. I love the atmosphere.,2014-12-15 01:52:56,0
107404,PipOty8_56C629wZjlDx9A,CPk6ozrDMy0ohC4-z0kGbA,Very disappointed with the new brand. USwirl had a better flavor offering.,2017-03-30 02:18:00,0
107472,XGDWVXtB8p6rKhJEG0S_zg,Wc-c_hQK4vFCl9keeVTUZw,"I can't say anything bad, best chargrilled oysters I've ever put in my mouth",2020-03-05 01:12:07,0
107484,7BhiY0D84Lj04kjEWn5fIQ,0bPLkL0QhhPO5kt1_EXmNQ,"Try the meatballs, they are amazing!",2018-04-07 18:06:34,0
107543,acLOor4HFm1IuyEfT08ECw,E9-k8aOCS2sSh9RYxvWU_A,Tots are good. The sharicha ketchup is not hot,2015-10-04 23:48:47,0
107558,aZpUMXB8ybm1CO1WGbt6uw,cN4Y09a7clgjFd1tY-wSZw,Great bar. Good food. Excellent staff. Cracking cold Dos Equis! Ask for Linda!,2013-09-19 21:09:19,0
107565,jsaN4TDygu76AGTiB3PpBA,E9-k8aOCS2sSh9RYxvWU_A,Waitress service is terrible. Not only does it seem our server has a fever but she brought us the wrong check.,2012-05-12 22:25:29,0
107594,14atJCcP992ghFoOcn-4nw,pl-F3mfBJaGSkTSM_BJtlw,Chicken Alfredo is delish!,2013-04-16 23:08:13,0
107622,1GnIzms3F3MJJK2kyIwuHQ,2kOGFDJ9v4T9AzuKWhwl2g,Super grande hazelnut latte.,2013-04-27 14:06:16,0
107673,4LkJIuob_334J33VjneAag,5nZfR9ksOZvqPnRSMM3FzQ,Regular-$3.14,2014-08-11 09:56:15,0
107709,ybg-xZe1eiZ7t8bZ0K5eBg,hyq0W0_Sc5PNyXBdxVki5g,"It doesn't matter what time of the year it is, the cream of chicken and wild rice soup it is best!",2014-07-28 01:40:55,0
107801,-B-QEUESGWHPE_889WJaeg,7IdIGemGZodDAA_9mJCigA,"You can say ""Breakfast All Day"" when it's not all day",2015-10-17 20:01:13,0
107841,M0AnYyp5EBMryhTNHR8oqQ,rBE5TT_ndOOczNBrbRnJwA,Great ((sangria)) and baba ganoush!,2015-07-26 19:56:40,0
107847,k9-ixq5thOj-KQX8V8D75Q,6bpM6wCmdp6qZGTQbiR3-A,Logan's Roadhouse Teas- made with Smoky Tennessee White Lightning Moonshine.,2015-10-08 03:34:55,1
108017,3hZ1Y-U4BCIEv4VouWlzGg,J_K_rgs3xZJkd3zAX1JxMw,Beach club is the beeesssssssttttt!,2012-07-11 19:48:23,0
108019,Twe6kQ8qvT8_FrcdpnxFUw,APW4-ESYGTIn17mY189Osg,Good quality and good prices!,2014-07-30 00:42:28,0
108057,1sA4O76JHK6c0_mhiidX3g,KYaxFTVWG_opECuNpdrUKw,Why would you ever go to Armature?,2021-03-14 19:38:16,0
108094,zQ1OJLGeBLGEcnIPzxlCPA,6GbuHdYPuN3jcSBmFplpXA,5.50-7.50 lunch special!!,2014-08-05 20:17:37,0
108105,RQjtzwpJOU3-_g_KxsbgUw,0bPLkL0QhhPO5kt1_EXmNQ,Zio's Italian market is now closed for good. :-(,2019-01-19 18:07:41,0
108138,WS4SX_UDrnOr3VyBz4U_rQ,jBCgQ6nZDsMCWU7eaSxOpw,Great BBQ! The macaroni salad is the best side.,2015-07-22 15:49:58,0
108206,lxkw0wVGhH-OQuCG3AwTxA,rBE5TT_ndOOczNBrbRnJwA,Wow the lemonade is amazing. I never get juice or lemonade or any sort of thing but I got a sample here and it's perfect. So fresh and precisely the right amount of sugar.,2015-02-18 21:06:27,0
108289,t6hWIBaIfA__NpxfGV0FVQ,4vLJd8N3wy_Q_wu_DZuRag,Soooo upset...  they r closed and we drove all the way over here and starving! Ughhh,2015-04-12 16:23:53,0
108334,afPZfpeIVRM9rNuDvbskgg,OXYcdeo8xeLsMtd4_ygeiw,"It's a bit out of the way, easily worth the drive!",2021-04-03 19:31:21,0
108362,87S0AGlgY7HDU_KkTbMHHQ,hGxzmfl3EjSoNLHsUJn1Lg,She makes a great mimosa,2017-11-12 20:54:09,0
108436,JriXL8qqw_tJ1mpwtlBabg,5cz1XbgalpQ89gsNQwneVQ,Delicious food and big portions..great service...smells great..and food is yummy,2017-10-11 01:28:45,0
108561,BHl_3GNHA2baCrtHTXaLhA,MuJBELBk9VXJjH0tryDh1w,Phenomenal food.,2018-05-20 16:55:21,0
108656,E2CuwvUZdhvrAvvNdmmN8A,9ewPtvw22mpbypTiOxd_kg,Still open!,2017-09-09 23:45:36,0
108874,tcNRiKTOnf2yH9L3QD-j2w,tUhPRgJ7mBx-1fGef7Nv3w,Great menu with affordable prices.,2017-06-08 22:41:01,0
108980,-ZHlPAvlVdgtiu6DiCq7Yg,hDiCHlTXKGUj1Yh4tq223w,Free wifi!,2014-07-29 21:28:19,0
109002,t0t4XNPtitNdgJv9UbfJgQ,6Ua4Pu_2bXuxpaxDyUA_BQ,Great tortizza!!,2013-01-05 00:15:58,0
109040,tHsxh7rGI8LUwXnHEEjkIQ,dIpTuL2T1L98GQGU17IeSw,"Bird and Pig and the Tuna BLT are awesome!  Thanks for the recommendation, Yelp!",2016-10-17 18:55:07,0
109062,HSyuv28UEVr8HMErs3L5cg,zUJMvjK6aBeQtVCowZ85-w,I like their food. The soy milk is my favor drink and sushi too.,2018-08-16 18:49:51,0
109291,Ropb2sxZ1Y0-fsB4rfIU7w,hQ-QZPwMyFEUDPm8opitvA,Open Wed - Sun,2018-05-10 00:20:56,0
109418,VL12EhEdT4OWqGq0nIqkzw,0bPLkL0QhhPO5kt1_EXmNQ,"Formerly Cesarina's. New owner, same recipes and mostly same staff.",2016-10-07 02:47:51,0
109576,oYn4yU4hI8w9vMQkR9bx1w,l9mfP_p3LetJNM9V0XKmkw,This place rocks.  Howie at the bar serving up cold beer (and Angry Orchard on tap)...and awesome food.,2013-01-15 03:13:08,0
109659,cr9SEw84c74IcV9kjBDaKA,jBCgQ6nZDsMCWU7eaSxOpw,5 pork sandwiches for 10 bucks!!,2012-01-14 17:20:48,0
109755,1idBtULpm_59kT9JP0wklg,6Z89Ixagyc0mrVnyZHiIVw,"First, you are not even greeted at the door.  The hostess walks by you twice, before she acknowledges your presence.  Then, without he looking at you, she motions and tells you to just take a table near the door.  We notice the restaurant is almost empty and we want a better table, she says ""no""",2012-09-21 00:49:43,0
109921,A4bsa7ykYRVCnb4h2vZALw,NIQWO-Q_F598XlAvZnFVCA,The Napa Burger was yummy! Must warn this place is loud and not for a nice quiet date lol.,2012-09-24 00:05:59,0
109958,Tv0nXlxIm601ukBs_h__Cw,AP_sb7dETsflRNNkJinYUQ,Pic of happy hour info,2019-01-07 03:59:14,0
109963,IlNN0372S7qPOMPLw5zbyA,rBE5TT_ndOOczNBrbRnJwA,Still have the sampler just ask for it even if it's not on the menu,2016-10-16 19:30:47,0
110044,z9m5bnhWUlRQZ4dfCQAh9A,fNfnyVFfn7B9zuU7cYyk3Q,Looking forward to a great show!,2017-10-15 20:59:03,0
110085,kOdoBSrx3ppUZAtYYKbyCw,TQloD2_k3J67Q1J_picgfw,I wish the President of the Philippines would buy this store,2016-10-08 16:25:22,0
110091,qQxRRzTT0U75A3mTVRh8xw,WtUxi5n8KlQdfgHZfB2Fqw,New stamp cards! For every $15 receive a stamp. Collect ten stamps and take $15 off next purchase.,2016-04-01 00:21:43,0
110270,_p9_GXbJNUJLkieaOFfhHg,4gn3wNWbNK8vPfoCN_BKAA,Tyrell is awesome! He is always attentive of himself and what all of the line workers are doing....always on point!!!!,2019-05-15 23:34:48,0
110300,JITevzyEgskIJc6sgOyEgw,kLG2-BOk3YHDXS8PCxekZA,Post Yelp event dinner,2011-12-02 02:01:53,0
110434,b4hKq2XFGFTQiI3Qj26W2A,OrE8LhQpKVXTA6gJyu5G9Q,Add or subtract anything you need to make any dish vegan.,2018-01-12 00:13:19,0
110435,WwulXySQN8t2hwqH_yWurA,b-EHLoRBtVgOpkv6-i1pSA,There's a food truck and physical store! Thank goodness because it is surelyyy delicious.,2018-04-30 23:36:03,0
110663,io9wpM-yvuDcZhXpS0EimA,CANuOWl6Z4soWkK2_1NWcw,Good food and good service! Very reasonable pricing,2018-11-11 19:15:32,0
110696,AeMtM_Cu3GY9gb96ktTOhg,Wc-c_hQK4vFCl9keeVTUZw,X,2019-08-06 02:03:35,0
110946,u1cvQWB0lB4YsIbtSlUR7g,UM6XgOtTX4DWWcGDTWtjEg,Great bike themed bar in the grove,2012-11-25 20:24:05,0
111041,15kr3p17ZFJzLu7y2rtoKw,oY5LFo6Yxxf32ePna6mEUQ,I highly recommend the body scrub and oil message. They make your skin silky smooth! I felt like a little baby. Very relaxing.they removed all dead skin from head to toe.,2014-08-02 01:42:12,0
111177,9Y6jR-1liGBZBBVGYVtmig,Idjv5ldTN-4Q7QseD46AOw,"Pretty good food, not bad prices",2019-08-12 19:25:33,0
111313,zLv3bqR6PFfjf0dba7ZCGw,A0F-h3xJm_6gHDKcDQwSrQ,$10 minimum on credit cards.,2011-09-11 05:49:01,0
111317,RMxvK_J_Pn3qWUxug8-8zw,GMjmrbksSxabPHYmhjsOEw,Today they got a special where you can shooting an ar-15 for free and I just spent 15 minutes with that high powered guy Wow.   I think I'm ready to go hunting now.,2014-03-11 18:49:44,0
111426,Y_2jMUKz6pvJ0JSWG3u10A,c8rjE6NcfeyzLB_aU1GdMA,"Happy hour 5-7. $1 off cocktails, $5 well drinks, $2 off apps.",2018-10-25 23:19:46,0
111443,XJqROiuFgSYwlw3-2nAI-g,lV0k3BnslFRkuWD_kbKd0Q,Bring your hunger! Chances are great that you certainly won't leave that way!,2018-11-16 15:37:11,0
111462,Zm6cBzAlC-rejV5ZtIbQ0Q,P6SiaPYpbduSSKt6lOAkuA,Friday's in the month of October. Trust me.,2017-10-28 00:04:49,0
111483,ik0UUieUX38rPg24heeVgw,NIQWO-Q_F598XlAvZnFVCA,Got awesome seats for game 5 of 2013 Stanley Cup finals,2013-06-22 23:23:13,0
111504,3Da5QZgC5jmn8-lQCnpDDw,jDds2solrdvoyK7sB97Eog,"The free breakfast is in Libertine, the restaurant that's connected to the hotel. It also has a great dinner menu and outdoor seating.",2018-09-18 19:17:00,0
111635,tBI1rbIioJ7o1_00OMXaCw,OrE8LhQpKVXTA6gJyu5G9Q,Busy tonight! There is a lot of people here right now.,2016-12-28 02:19:23,0
111644,__MKhx-akV8K6wI6SswQFw,buhO8vRCaEoNvlxU0AJRpQ,Close to the new Trader Joe's!,2014-03-23 17:03:42,0
111646,WzJdhEL91X4qjfqgJWeFLg,hYonVJe6xzVBHHT2FLo4zg,Chicago Style Deep Dish,2021-05-04 22:05:41,0
111678,FpjPSS-TD5hYK1F08gPvqg,cB5NEUkJOSIrjZR-agSltA,"Terrible bar with an ever worse owner! If you're a veteran, you will hate this bar cause the owner has no respect for you!",2015-11-03 05:56:38,0
111682,nxNO7_6U2Nu90v0IdnEhIg,QkyEr9j7il9lJqseTbPe5w,"Housed in a ca. 1919 building, which was Media PO until 1980s, then Borough Hall until the early '00s, and at least 3 incarnations of restaurants since then.",2019-04-20 04:15:01,0
111701,cRij9215tfbhiLdHmcdUWg,_KSRzh-ZxwKB3YcRlZQsGA,For years this establishment was 'cash-only'. They now take plastic too!,2019-10-14 20:41:39,0
111825,sraTrYU-7q_bQ0TxQrLJvQ,6Z89Ixagyc0mrVnyZHiIVw,Get steak shrimp grouper & chicken tacos on Tuesdays for $2.50!,2020-05-12 19:37:11,0
111834,zUk_Ww2q1At1QSyRbUjIGQ,ostgbmaf36hOicxyl71sPg,best white in our area!!!!!,2017-04-29 16:50:12,0
111895,iniAye73-Wax5U1TKTUN2g,rBE5TT_ndOOczNBrbRnJwA,Awesome paninis,2012-12-30 17:05:02,0
111989,bjX58cooXPxdNfR0GZ6r9Q,D7Os2-9ApTGmNyzidqfwGA,"Love the quality services and the personal touch, esp for locals",2020-01-01 00:32:09,0
112090,2ojg5WZeDIiRBJbDloxbOA,aG7LRLXT9iLh59QT-2gaTw,Taking advantage of a $5 off coupon so splurging with the mix fajitas dinner,2019-08-29 22:41:20,0
112189,SMDc9iFLvZZ0Guz4ab6u0A,vPcfJ3rm3NpdqVDod2WxLA,Ask for Meth or Coke reason being that this place is obviously a front,2017-09-04 21:22:19,0
112253,O85MriJ0e29pVao2wxbbPQ,2g1ZiT6cM1NC4nJ8xS6EGg,"Good food, Great service.",2013-03-20 02:03:52,0
112272,LvdzLiWU9gkUUqycDX8l-Q,KabN4d4St6gxsVIA1KzS7A,Great neighborhood fitness center. Clean and well taken care of.,2017-10-02 22:52:39,0
112315,wNrvFJDqKkaaecXmUZtQxw,7hpUoYdAVToZXwuPRgoqdA,Oh so cozy!! The atmosphere is so relaxing. Definitely my new favorite place.,2016-12-10 16:24:08,0
112419,RFeir8oS6LD7M5MZcX8T4Q,2g1ZiT6cM1NC4nJ8xS6EGg,Really nice staff!!,2012-05-20 01:35:05,0
112476,v0EotJGledWfectNMW7oww,dIpTuL2T1L98GQGU17IeSw,"Get the veggie burger, in the wrap, add avocado and sour cream, ask for it pressed. You're welcome.",2014-04-14 20:31:20,0
112567,UJEGCmwVgJeF-05grac6Tg,0yElmJZHbfRJt4gmdot8Og,The kids breakfast is cheap and they can choose from multiple items to make their breakfast. Great for picky eaters,2016-07-29 14:55:11,0
112579,E9Vs89OXrFEcQ4k46YPitA,SbdL-8NSmTWgSwdGZBa7WQ,Bomb pizza.. always fresh and delicious,2017-05-23 07:12:01,0
112652,bJ5FtCtZX3ZZacz2_2PJjA,7hpUoYdAVToZXwuPRgoqdA,Yelp Office Hours are cooler than yours!,2012-01-24 22:59:40,0
112664,lpNf8qvz-VoXWWpyWo07Pw,o2i4AvqF6Q9lWK-wksxzuw,Had the Nutty Faroe Island Salmon. It was delicious.,2016-02-28 00:20:29,0
112718,PM_cehtJnYVv655eNwtJQw,AP_sb7dETsflRNNkJinYUQ,One of the best breakfasts around. Good bloody marys.,2018-04-06 20:18:21,0
112731,ORUTR_EZkb6Hzz0nOroLvg,BZm2VrI3NHE4ZP0CHuwO7Q,They get it done all the time... every time.,2018-01-15 23:22:39,0
112793,0_eWZ9uSQfsE6Huvbc85fA,-Tnsc_b8dsWuAq1wQugKZA,A nice place. Great food and you can get serenaded.,2013-02-23 00:59:19,0
112903,EHAZM4l7x7e60RhzQhU_wQ,6Z89Ixagyc0mrVnyZHiIVw,"Food is good, but service is atrocious.  Servers do not care and disappear.",2016-11-29 00:00:02,0
112925,ZWKJ0YGSQer9Rji6yZSRpw,PFEC0Z-5rT7l_DR6cySCOQ,Nothing yet...... this place is the best,2017-09-28 01:05:01,0
112999,vRp6jlO9M6wLi150CvX6Ig,UM6XgOtTX4DWWcGDTWtjEg,"They have a vending machine full of quick repair bike parts & a few things like bike lights, sunglasses, ponchos, condoms & smokes for a riding challenge",2014-04-13 15:39:03,0
113020,kTwH5B_uaeYI_isMZhWeyA,UYxGgnJ4Z2lOehK23HSIlw,Quick and complete wash,2012-10-16 13:38:43,0
113041,bJ5FtCtZX3ZZacz2_2PJjA,JUlsvVAvZvGHWFfkKm0nlg,BBQ Mixer with all the fixings!,2011-07-30 23:24:07,0
113078,CJNHCzvFcC9sRsEScLuqQw,OrE8LhQpKVXTA6gJyu5G9Q,Ate hear last night.  Great food and great service!,2014-03-13 13:20:35,0
113109,EnxVhGYItKo2V7AXteGsIQ,dIpTuL2T1L98GQGU17IeSw,Loved the bruschetta!,2011-02-03 01:05:13,0
113200,01IhGl0XmthVaN1n0yVpfQ,6kx5nIZh9bQ_02_GOcE7bg,"As far as fast food goes, jack in the box has the best breakfast. And it is served all day!",2012-07-26 14:44:20,0
113237,xhzsIUTO1UBTI5hMV7e9_g,NIQWO-Q_F598XlAvZnFVCA,I was really hammered. Great.,2017-06-15 07:10:42,0
113369,IXmSMOc_yWIzZzrTrCU6qg,GlYN-RJyL_YwxIqsSDo1ag,"Don't let the crappy strip mall fool you, this place has truly excellent food, homemade sausages and breads, expertly cooked eggs... I love it!'",2013-05-27 19:03:00,0
113388,87UCNW0g5gygrglDxjyDRQ,YhQAQhG1IkXJH7oLZMbM9w,Workers are too busy on their phones to work,2017-06-11 22:25:08,0
113407,5MnyLEFhIZlI-Xm98PqCvw,UX3eq0WsVva-cqlVrzyzFg,So came here during the day at the chili cookoff. Stayed fifteen minutes n never got served or acknowledged. Walked out!,2011-07-24 02:30:01,0
113542,rw0vvALQ8cghlzoBNJ9Hlg,r43DrfYAbAgifsYyNkljZw,"DO NOT EAT HERE!! I attended a seminar held at the attached hotel. We had 1 hr lunch. 4 of us sat, There a few other tables. There was not enough staff on hand and the food was REVOLTING and FOUL. Needless to say, we were late getting back to the seminar - The restaurant is attached to the hotel!! That's how slow the service was. I told the manager numerous times that we had to get back however were served our DISGUSTING food 8 minutes before we had to be back. Also the place is very dirty.",2017-09-20 11:04:13,0
113545,vrSTo2_r3v_jhw2B0VwbYg,NIQWO-Q_F598XlAvZnFVCA,"GREAT beer selection. Careful on the burgers, they tend to come out a little more rare than ordered.",2013-08-17 23:33:09,0
113571,o9uej6H3JbSx1UScuez43Q,3tX0CduxNIHgrxr6Toairw,Orange aprons are always helpful!,2015-02-15 21:15:03,0
113584,PjtWwyNNih8TLxpa2tZaYA,o2i4AvqF6Q9lWK-wksxzuw,First time!  Real excited!,2011-01-02 22:49:12,0
113615,7iLlx8AlXOgLe0eH8FddJA,NV6zZPb5OGVpyX4JrSzUPg,Service is ok. Boring food.,2015-09-09 14:27:47,0
113616,vRp6jlO9M6wLi150CvX6Ig,UM6XgOtTX4DWWcGDTWtjEg,"If you're the sort of person who is too easily offended by a dance night cover charge, check at the door. Some nights are free to enter. But if you're that easily offended anyway there's probably an AM talk radio nod-along, HOA lawn measuring & harassment club, or hand washing meet-up somewhere else that's more your speed, or at least try some dance classes",2014-08-24 04:32:35,0
113628,T6kTCav3ghya91_NIF3idQ,dIpTuL2T1L98GQGU17IeSw,"Overpriced,  and small portions.",2017-06-16 04:02:03,0
113634,ET8n-r7glWYqZhuR6GcdNw,7hpUoYdAVToZXwuPRgoqdA,Yelp Office Hours!,2012-01-24 22:13:05,0
113725,3uKNYfno_bz_uUAgaY6_AQ,UX3eq0WsVva-cqlVrzyzFg,Salad with cilantro vinegarette dressing!!,2011-08-26 02:23:54,0
113910,o6e3LvmZOkxG867d0eeWhw,oY5LFo6Yxxf32ePna6mEUQ,part of it currently under renovation.,2012-05-21 22:13:25,0
114104,Bjk0URaYFA8k8F-Cmxltag,APW4-ESYGTIn17mY189Osg,The pick two options are great! Try the flatbread salads.,2016-04-24 00:14:19,0
114303,4KV_ptAjl4xFO6Y3Rpa3MA,vrQCClTDrPSbIHO-ub8qFg,"On your first visit, you must have what they are known for - pollo a la brasa which is Peruvian chicken authentically spiced and perfectly cooked.  Typical sides are French fries or Yucca fries but there are a variety of other options including excellent sweet plantains.  You WON'T be disappointed!",2016-02-01 14:12:09,0
114345,TF9tFJLuVdu9zzjH2wxcOg,o2i4AvqF6Q9lWK-wksxzuw,Today I am trying the buffalo popcorn shrimp it taste amazing but I recommend a side of blue cheese dressing.,2013-12-09 20:18:53,0
114398,gzpQY-UgOWjx8ofesG66iQ,NIQWO-Q_F598XlAvZnFVCA,Such good food! Especially those corn dog pops!,2016-11-22 19:23:01,0
114405,DdN73eqFRodXD3jcUYWz_A,noByYNtDLQAra9ccqxdfDw,Absolutely one of the best clothing stores with great customer service.,2012-03-13 03:44:31,0
114747,23yyDv2Q5R0xPRazb3EVmQ,f_xxwfH2g_WkOdtDq5LFNg,Order Super Fries!,2017-09-21 03:39:41,0
114836,uNSoKfNUNeWnjb3HB_AVuQ,kWrn-inIIahiSFWft-13qQ,"Service is super slow, and it's quite loud inside the restaurant.",2016-04-27 01:14:25,0
114977,Nx1ULSgBxiwq7I1LkF_fWA,6Z89Ixagyc0mrVnyZHiIVw,Nothing to not like!!,2012-11-10 02:41:49,0
115061,Cg2dYxOEnEezhkq-h5w5JA,QWqKTWQ2OiDgo3dzNkpung,Yummy tofu,2010-10-23 00:00:32,0
115252,nAfUkqrRQ4bozQZyuq_M2w,GlYN-RJyL_YwxIqsSDo1ag,"Dirty and poor atmosphere, in a sketchy neighborhood.
Food was mediocre.",2014-10-08 18:40:26,0
115264,j2Pf3ScRHEkh5TZLfEm-Kg,OrE8LhQpKVXTA6gJyu5G9Q,They do use MSG. Be advised.,2011-10-07 21:07:29,0
115318,n0nnMMSfyfcBX4juJadYEg,H2nFgEFitRk7ltE8IRH0xA,"If you miss the camouflaged entrance going west on Kennedy, you can always take the small back road behind Walgreen's on Westshore to get here.",2015-09-14 02:28:13,0
115384,5LaEgEuZhrcfpB-r-HW5tw,dIpTuL2T1L98GQGU17IeSw,Liquid heroin iced coffee was the bomb! Food was alright. Cool place!,2016-02-28 18:30:34,0
115391,3KHntvRzW6WhhkPcY31EGw,Aphp-EdFass877c-sWp5eg,Best Eggs Benedict ever!!!,2017-03-27 23:58:05,0
115444,4DyMRBKrokax6d8LCI3GAw,7IdIGemGZodDAA_9mJCigA,There's a wall made of Heinz Ketchup. 'Nuff said! I'll be here during the Apocalypse.,2018-03-31 16:12:51,0
115523,EONzhbeZk6ycGqC7Ovou6g,UX3eq0WsVva-cqlVrzyzFg,Half off margaritas on Mondays!,2016-06-20 23:55:27,0
115664,n0nnMMSfyfcBX4juJadYEg,UYxGgnJ4Z2lOehK23HSIlw,Get the monthly membership. Pays for itself even if you only use it occasionally and your whip will always be on point.,2015-02-27 21:25:33,0
115796,7h4J93R4hU5LRUUjKtSeKQ,6Ua4Pu_2bXuxpaxDyUA_BQ,Omg delicious chicken quesadilla!! Way better food options than expected.,2014-09-14 02:16:19,0
115830,-WM58wLjtlHlR91xVfM1FQ,GlYN-RJyL_YwxIqsSDo1ag,Get the green corn waffles :),2014-06-15 19:14:43,0
115985,Gq4iGqhXHY3Q1C-tja7_AA,JUlsvVAvZvGHWFfkKm0nlg,The El Camino Margaritas are great!!,2014-07-29 22:23:57,0
116002,OtLw_rFdk27Y8e-s3C-Kdw,qWZimITbVwNSGJZsuM47-Q,"Updated lunch special: small bowl pho with either an egg roll, spring roll, or 1/2 poboy, plus a soft drink, hot tea, or unsweetened tea for 9.95! Dine-in only, from 11-3pm Monday-Friday.",2016-03-14 17:41:08,0
116065,r_rPejSLvONI5-CgV78IMw,kLG2-BOk3YHDXS8PCxekZA,Good spot for quick drink before a show across the street,2011-08-20 05:15:45,0
116097,29qZPAb3ohwD1Dj2tfk4BQ,c7W5jnh7wMlVmKf5bJPBPg,"We miss you, ladies, and hope your new store in Nashville will be wildly successful.",2012-08-01 07:54:11,0
116148,gt5NNY2kxAK50bGVv9d_ng,r43DrfYAbAgifsYyNkljZw,"Dine aboard the deck on D-Day for this year's Taste of South Jersey.  Join us June 6 the anniversary of D-Day in honor of those who served and participated. (A military discount of $5 on active and veteran tickets.)  Delight in varied samplings from our many participating eateries.  Cash bar is also available. Battleship New Jersey

Participating eateries to date:
Red Hot & Blue Cherry Hill 
Classic Cakes
Seasons 52
Wawa
...among other's",2016-06-05 16:21:51,0
116175,3GvXapvdYm6XqV5IH8xZOg,yuW60QyweNNcyHa_3fkrYA,"Don't get the ""homemade"" chicken from bouillon soup",2013-08-25 19:29:12,0
116182,amEojxrEu9V97AbgCTF_Gw,JUlsvVAvZvGHWFfkKm0nlg,"Great place, they have fast service and the food is good.",2014-04-09 00:23:06,0
116191,8UeZJLoiyJAJvbbTCpIusg,AP_sb7dETsflRNNkJinYUQ,Dog friendly! They bring your dog water bowls!,2017-01-30 11:23:19,0
116193,ymrd0guGWD9fB1V0zeOBrA,NIQWO-Q_F598XlAvZnFVCA,Best place in town  for brew !,2013-07-01 18:56:03,0
116253,qPyX-tG3m8gmJU_ChHp4eQ,9D7dDnaZZglUOj75xFy-nw,The chairs are average but my nails have looked really great every time!,2016-05-14 17:57:44,0
116438,10HuIxFy4rGBvl6wtKlUEg,HsibLfc2XD7Gh7Hbd1WfJQ,Toilet in the men's shower room is FINALLY fixed,2017-07-20 19:50:01,0
