,user_id,business_id,text,date,compliment_count
157917,uFeOjdf6s5sNZAk0D6VMgQ,GyC36Pn0Q1-qHnqXys6yFg,"great service, great food.  what more do you want?",2012-05-06 14:52:40,0
158027,jWrs3t8ev5PhlCbyB32g5A,nIxepiPUk5FUfL4u9EFfew,Great beer selection!,2013-11-13 03:16:46,0
158186,jllqb6ymVR_SW_TbbtNypA,MTSW4McQd7CbVtyjqoe9mw,The cold tea w milk makes my day.,2012-01-27 17:25:35,0
158343,LlIZmwJLnw7PMDktDiy6sw,7hpUoYdAVToZXwuPRgoqdA,Getting some reading did on this beautiful summer Saturday.,2011-06-25 18:46:46,0
158368,n9TbieFQnpib20mEIOjWGw,6Ua4Pu_2bXuxpaxDyUA_BQ,80's night!,2012-07-08 03:17:11,0
158373,gjhU-CY6cUITsveM6lPRmw,OrE8LhQpKVXTA6gJyu5G9Q,"Best Vietnamese food in town! Reasonable prices, fast service, and amazing food!",2015-03-22 21:12:08,0
158449,XlRL8oTsdWxadxaGjvaJjQ,Af2UlNzQSiZCapJ6qtwu6g,Love the vintagey goodness.,2010-05-02 19:30:32,0
158473,nKlAYCi-7nvrCV5caUahlg,NIQWO-Q_F598XlAvZnFVCA,They changed their menu! :( but I'm going to try their newly added steak :),2013-02-02 04:14:50,0
158506,fDW8EMjm5_PPciQTSfdigA,kLG2-BOk3YHDXS8PCxekZA,"Slow, slow service.  Ok food, but nothing special.",2016-04-10 19:00:16,0
158521,sTyvPtWrEeqNcbmLcHclGw,qWZimITbVwNSGJZsuM47-Q,I walked a mile to get here and they're closed!,2014-03-02 06:11:21,0
158550,GLW88P0_zeQtaiLM9WA4Ig,GyC36Pn0Q1-qHnqXys6yFg,Always great service and great food.,2018-01-08 20:26:40,0
158878,1wioPwD-Fj2kaI5wEXn6vA,0ByzGehS0T5muzZ2qYGq_Q,"Very professional and friendly staff. EXCELLENT flavorful, well portioned food!!",2016-02-03 17:43:35,0
158884,ZWG8g9x2cc7ltHhnVjNASg,jBCgQ6nZDsMCWU7eaSxOpw,Slab of ribs!!!,2012-06-10 16:50:32,0
158952,hydXObhltFHH6gqZ-7t0HA,aUbwGgYBX-kP4O3JgLCuXQ,Very beautiful. The friendly and polite staff were simply the best I have ever had.,2013-03-17 16:59:56,0
158966,t5ZOZ0DcsLNQA8x9kHYHkw,GyC36Pn0Q1-qHnqXys6yFg,Best to have a party of two. Get served faster.,2013-08-11 14:23:28,0
159102,2z3_g6gOVqVTI4tlaakZ1Q,DBLGuRJ8NaDsanzoaIw2rw,Hmmm. 2 bacherolette parties at the same time. And a 3rd on the way. Lol. Who would've thunk.,2013-05-04 02:46:53,0
159172,Yw0iaR5P6ilmSn12K2YZAQ,NIQWO-Q_F598XlAvZnFVCA,"Took my family there for lunch. Overall, the portions were small for the price. The strawberry salad was good. The fish tacos had very few pieces of fish and the tortillas were bland and seemed like store-bought. The pulled pork sandwiched was lacking meat and the sandwich was dry. We liked Silvergreens better.",2013-07-09 19:47:52,0
159176,paDeS9pz30vLSEd4gx8NeQ,7hpUoYdAVToZXwuPRgoqdA,They have chairs made out of silicone strings. They're super comfortable!!,2016-03-07 20:12:19,0
159204,dVC0ZDH112PIP6QBfaiAAQ,QWqKTWQ2OiDgo3dzNkpung,Mushroom tofu pot is the best!,2012-01-24 23:27:05,0
159208,QoLdMLB4V0920bXffKQ1XQ,GlYN-RJyL_YwxIqsSDo1ag,Closed Tuesdays,2015-08-18 20:00:52,0
159248,qN3Wd_A_0BQE1Qt4u_oZvw,_E0WPHfJEYmwOUCAj-Jq1A,Hit the early bird specials at Pancho and Willies. $6.50 for some amazing meals!,2012-04-21 02:46:02,0
159394,_qhSepRmXrulxeJWMgrUNw,S2Ho8yLxhKAa26pBAm6rxA,"Had the blackened chicken salad! Bomb!  
Bread Pudding AMAZING!!!!",2018-09-14 19:49:54,0
159492,S9_LlDbf9A0d7-Gcsd6H-A,NIQWO-Q_F598XlAvZnFVCA,If you like hoppy beers stop in this week! The bartender just told me they are featuring them all week.,2014-05-16 21:19:03,0
159506,1FquvyqIeziQ03o4dRYoSg,FHnYL-Auw0Q-epPYZZutnA,Great grungy bar to get a stiff drink or enjoy a beer from their wide selection. You can play some pool or darts with friends. It makes me wish I was back in college.,2013-07-26 23:22:39,0
159758,fBdkXLwZ8pZBu_GyRY4DUA,x8joRxn_TPorP1C2LSdSYg,Food was good. Menu was a lil to restricted for a bar/lounge type of setting.,2019-10-03 18:15:20,0
159773,bq3rhDVtIASZQZG6DP2I1A,2g1ZiT6cM1NC4nJ8xS6EGg,Go on Mondays. Sign up for their email deals. They send out Monday specials super often.,2015-07-31 23:50:00,0
159793,dfbaXDj9M38FoXpqHCLjkw,FiPzoDUHkE-W7TdtyuBRBA,Buyer beware,2018-10-13 20:59:37,0
159824,qIH30HYlMpdVTUc3shLuyA,S2Ho8yLxhKAa26pBAm6rxA,Great service and delicious food.,2018-02-16 14:12:28,0
160050,Si3aMsOVGSVlsc54iuiPwA,J_K_rgs3xZJkd3zAX1JxMw,"Not bad, maybe too much mayo. The fastest service I've ever seen.",2010-11-10 19:40:09,0
160055,Hi7_9ZD9Mo-HCopZeg48nA,cN4Y09a7clgjFd1tY-wSZw,Crowded @7 on a Sat. Go figure ....,2011-03-06 00:32:39,0
160139,En_NjhO_cMm0KsRGvO7uzw,iZqdoqow3e7-D71_Lx_2Eg,Dont wear a jacket with a zipper ( if its apart of ur outfit) they will make u pay for coat check! Get a VIP by the stage. Verify bottle sizes.  Go on a not so busy night,2014-03-28 18:21:23,0
160140,eFN0dcz62OqrLkCjeLakwg,JUlsvVAvZvGHWFfkKm0nlg,Great atmosphere. Great tacos. Pretty great prices,2014-06-01 16:31:17,0
160168,c3Stx6zeVeXj4MmDZvW11A,69y8BIrahfo6I_5AkIYf-g,No value menu :(,2016-04-06 21:40:15,0
160204,bcudERVuFRjt7A-wRhz3Kw,o2i4AvqF6Q9lWK-wksxzuw,Great food. Good bartenders.,2014-07-23 23:34:10,0
160216,sWqyquvU7n8V44tniLza-g,OrE8LhQpKVXTA6gJyu5G9Q,Can u tell i'm asian??? Lol,2011-04-03 03:13:45,0
160232,2PtUaDGbtFITLF0_t9LOTQ,0kE6ONRsxXF44QLvEUyr2A,It's old navy,2016-06-03 02:14:14,0
160245,3fLu6K7fStK-sAt6-YlxLg,UTm85DD1C_GMNrDzJVT9nA,Always delicious and very fast service! Never disappoints,2018-10-26 17:30:05,0
160297,-IGQoMfCbys3q1OHVemgMQ,lNsnmur2Df2oK9ywyY0H3g,Back again and loved it. Love the quality of the food. The sampler was great.,2016-06-13 14:23:40,0
160341,2Eb8aKOZROAPkWxsBXf_qQ,o2i4AvqF6Q9lWK-wksxzuw,Our server was Leslie. She was outstanding! Attentive and courteous!!,2017-01-17 00:49:04,0
160420,JUbpQO8EHpwpNq7VCWFseQ,dIpTuL2T1L98GQGU17IeSw,Great food and friendly service.,2018-07-25 18:20:51,0
160451,qbq4zC9SrZuaQ4-J-wtRuw,OrE8LhQpKVXTA6gJyu5G9Q,Don't go near closing time.,2011-06-23 03:14:12,0
160642,XP-6QlIM_QQbpVJ09itTrw,NIQWO-Q_F598XlAvZnFVCA,Yum!! Wonderful food & drinks! Fun atmosphere too,2016-04-15 05:45:42,0
160763,FhbRFC8WRI5Kcdja_-GGeg,rBE5TT_ndOOczNBrbRnJwA,Really good lunch spot,2016-09-10 17:42:50,0
160821,xPFWf4Zq5XuWldHILlbYHA,FHnYL-Auw0Q-epPYZZutnA,Perfect place to drink,2012-12-22 03:30:29,0
160928,77RhW11qj06HIvg59BNBbw,eaVcAlPmz-3C2ICy4zqbfw,Friendly ladies and they all give good haircuts!,2013-10-19 19:39:54,0
160982,_U4qUFUuWOkVXRnbNKkpJw,lNsnmur2Df2oK9ywyY0H3g,First time sampling Peruvian food! It's great! Food and service was spot on!,2013-10-27 02:08:01,0
161129,gBmA1dVK-dw4dJO-GtRuHw,CANuOWl6Z4soWkK2_1NWcw,Amazing food!  Large portions. Great friendly service.,2018-12-31 23:51:24,0
161142,XF_HQrcRBvHiKP0OWcWbAw,6GbuHdYPuN3jcSBmFplpXA,I would not return to this restaurant horrible customer service.,2013-01-05 01:59:42,0
161158,yLNVf92fT7e9clI8Vm9e2A,nIxepiPUk5FUfL4u9EFfew,Order at the bar,2014-05-25 23:26:20,0
161272,KRtMhleMF6h3imn1_1PfFg,nIxepiPUk5FUfL4u9EFfew,Scott is awesome!  Happy Birthday Traci!,2011-02-22 05:43:51,0
161317,9PkxagRjAvSFirnhxJ-s3w,UYxGgnJ4Z2lOehK23HSIlw,Always fast and a great value!   Highly recommend,2015-01-02 19:21:44,0
161335,hMm6xWSsX74YQcQaNZ75nA,UX3eq0WsVva-cqlVrzyzFg,This place has the best margaritas and tacos!!!,2016-02-08 21:55:24,0
161342,Y9LL0fGyIZ01JcouqBV_Kg,o2i4AvqF6Q9lWK-wksxzuw,Restaurant week.  Good prix fixe menu.,2011-09-27 00:25:43,0
161345,HYya5AB8dLC4G3cNssvdIQ,GlYN-RJyL_YwxIqsSDo1ag,Yummy Sunday breakfast:-),2013-08-04 17:27:23,0
161362,8Y4ex1i-xUF5ISXovoyDgg,5lGOPqwxBNR9hfA9mFr2vA,Best Mac N Cheese I have ever had!!!,2012-07-07 06:29:06,0
161390,TGVfj56o_3vK7R327Md2zw,kLG2-BOk3YHDXS8PCxekZA,The bean roll is phenomenal as well as the staff! I will be back without a doubt!,2017-05-17 23:23:07,0
161422,6Vu4VxT1k_URONQDWw2pdg,VVMAvAVRpoVk6bd4avvYGw,Worst service and food- even for a college bar.,2016-10-30 11:47:21,0
161438,meOoQz9HJpBjdFX9I_IL6w,MuJBELBk9VXJjH0tryDh1w,Fantastic every time we go there. Service is great as well! You must try it!,2020-10-04 16:53:29,0
161439,d4n7rtM72KX2X13xy29b9Q,Fe9WDVsrEM9H0X_aFDuYVA,"If you order French Onion Soup, eat there. Don't order it to go.",2021-03-10 23:32:44,0
161467,oL7gntkQjs8U-BYrS8l23g,nIxepiPUk5FUfL4u9EFfew,Had the BBQ buffet... nice smoky flavor.  Really good beers on tap.,2014-06-02 18:00:17,0
161471,P6hheZa5k5BKDgXelvKD7Q,0yElmJZHbfRJt4gmdot8Og,Good food. Nice people. Neighborhood cafe.,2016-07-22 01:36:14,0
161676,wkSG3ihodqLwFdipeW1lHA,zmLhgTlXQn3ZP09MIFEc4A,$30 for chicken LMAO. This isn't New York f#ck outta here with your $30 chicken,2017-12-01 01:02:09,0
161730,-130F63yo4tvp8ZwCLiZ2A,6Z89Ixagyc0mrVnyZHiIVw,Great place fun and service is great..,2016-10-17 23:44:00,0
161902,QQMK9KBN-edGT9Kz1xiBYA,6Z89Ixagyc0mrVnyZHiIVw,ivan was a great server ! id definitely come back good food,2019-08-26 04:17:09,0
161962,TICATQ2MPveEPnx0AyuaEg,cN4Y09a7clgjFd1tY-wSZw,Don't expect phenomenal service.,2017-09-03 23:50:35,0
161990,YW-3YXtHEg49e1A_VlGbfA,vrQCClTDrPSbIHO-ub8qFg,Food was delicious and the portion size was huge,2018-06-30 23:47:18,0
162007,Uv7gLTHGZyHANFSOlrZWdQ,6bpM6wCmdp6qZGTQbiR3-A,No more peanuts on the floor! Bummer.,2013-08-04 17:31:09,0
162076,Tl8TQzL01m4aTaINHE-t1A,aUbwGgYBX-kP4O3JgLCuXQ,"Absolutely amazing venue for a wedding! The staff team here are also very friendly, professional, and well groomed for the occasion. 5star venue!",2019-06-24 21:52:35,0
162079,mEUBi9brNMCZQnNNqWKnLQ,g6kAgbQQSQ8i1A_Za-znJQ,They've always been pretty good here! Never burnt or old.,2013-04-10 19:58:30,0
162229,TR6LSn34frvMvEtIlcp6Yg,vrQCClTDrPSbIHO-ub8qFg,Everything was so goooood and the price was right!!!!,2016-10-16 01:42:35,0
162236,DfkThDHkN-pOI1l8RzaTRA,xIz9cCuddNbDUcItCo5V0g,They have the best wings I have ever had! Sweet bubba sauce is my favorite!,2018-03-04 00:25:15,0
162382,eVioq5OcCvHR4ummfqSuXA,zn-WXkqHag5FSVc_LC9dEQ,Love love this salon. Have been going for about 3 years!,2019-02-07 01:34:57,0
162383,YW-3YXtHEg49e1A_VlGbfA,vrQCClTDrPSbIHO-ub8qFg,It's all about the chicken,2019-01-30 12:22:53,0
162520,2M6kg8Xvafi_nKGhdj8loQ,HX3UAADrWMqReSRIrKteOA,Worst pedicure ever!,2021-08-20 20:21:37,0
162524,29aKnf4_uYRZhcKe0VmCUg,s4WB8cWQ7whXfgIJoR7Mdw,They card every one who looks their direction,2017-11-14 05:04:11,0
162624,STQyJjqMqLmZ0L9PpkmyDA,_KSRzh-ZxwKB3YcRlZQsGA,This is the best place ever!,2017-05-12 16:01:58,0
162645,O2wmZY-vMlacy_xlQFE9KQ,kk_oEw1j3xQ-cJaAII8A0Q,Best giant ever.,2014-07-13 11:10:15,0
162677,kBb1I_2qzKprwki5rjnm-g,jBCgQ6nZDsMCWU7eaSxOpw,They're out of business.,2017-07-20 00:55:43,0
162800,2yb95i4vV1m9zx-AXxzCLA,A0F-h3xJm_6gHDKcDQwSrQ,The best. The end.,2017-02-19 18:36:59,0
162818,DIh1S6jYxslGMBe2jkLPHw,CVt2-nlsxOz5NSdM35NSkA,"I am Korean. As a Korean I tried lots of Korean restaurants in Edmonton. There were a few good ones but nothing satisfied me 100%. Untill today. When I passed Tofu house I never could guess it was Korean restaurant (I thought it would be vegetarian lol) I am so happy that I tried here today. Service was great, servers are continueasly checking if you need anything more. Food is awesome!!! I felt like as if I am back home. If you are a Korean or Korean food fan, you gotta eat here!!!!",2016-02-12 03:03:31,0
162832,5FuawPJYEz40Cq9_ZNXC8g,OrE8LhQpKVXTA6gJyu5G9Q,"Give it a try with fried rice and noodle.

This small shop also got wi fi",2014-04-27 02:00:49,0
162891,dKTDj8zp5GGlXqSFsO-flQ,P6SiaPYpbduSSKt6lOAkuA,Awesome food.  Great staff!,2017-12-09 15:40:31,0
162935,QZGTmo3U2pDXaLOfUOPKRA,LVteL0Rnh2E_yOFCLJUPhg,Try the Inside-Out pizza.,2013-10-19 19:03:30,0
162998,fLz4dZ48JOatSWuFO0edNA,NIQWO-Q_F598XlAvZnFVCA,Riquísimas las hamburguesas muy bien servicio y muy lindo el lugar bien ubicado,2018-07-19 06:09:09,0
163072,GnBwHRsvDF-ShIVcEsffAQ,weT7cLIyVWvSJMRqZMpvYw,A great gym with all the equipment you could possibly need,2020-08-02 19:07:02,0
163216,dRJBB1u9AwOAN8gGRvZnBw,US2-dEVvnOdde7Syi18TTw,Great food and super friendly service.,2017-11-14 14:28:48,0
163255,zjH4nVGTNeDSxY5H-oC-Qw,vrQCClTDrPSbIHO-ub8qFg,Amazing food! So delicious. My new favorite spot!!,2017-10-17 04:56:41,0
163466,7rEdefPMMCOCKHs_uJwYdg,0bPLkL0QhhPO5kt1_EXmNQ,Please re-open. I am lost without you,2019-04-14 21:22:00,0
163654,X9LT66H7NosO9MOSm_qt8A,lNsnmur2Df2oK9ywyY0H3g,Really authentic Peruvian cuisine!,2017-02-24 17:37:37,0
163669,DCgJ-fx1h5EP7LQz4fnTPA,kex3ujGWOUvBX_ms4Etdtw,The food is so good I could cry.,2018-10-25 21:16:20,0
163721,dYmcAu8sBvMjSRR45vE0BQ,2g1ZiT6cM1NC4nJ8xS6EGg,"Love the food and service. Sit in the bar area and ask for Tracy, she's the best!",2015-12-02 00:44:10,0
163861,Q8O8d8OT16Ia-1L7D8efOg,uegqsjv7JYqYkG08jPv0jg,"Full service barber shop, style cuts, fades, tapers, flattops, and straight razor shaves!!! Call or text ahead for appointments @ 520-312-9024.",2014-12-12 17:18:44,0
163942,6jOavX6qC2Ov5_lieR5Tig,A0F-h3xJm_6gHDKcDQwSrQ,THE place for gelato!,2012-04-22 16:41:14,0
164010,X9LT66H7NosO9MOSm_qt8A,lNsnmur2Df2oK9ywyY0H3g,Great red snappers tacos,2018-07-04 18:51:55,0
164063,a7F2IBCXDO0-ACj7TiETtA,frsWe9bmMOMIBOBNzsCTew,African time!!,2013-06-30 00:39:42,0
164186,lA7BzuxMJwDJpJmetn0sBw,CANuOWl6Z4soWkK2_1NWcw,Best boiled shrimps and fried catfish on Magazine Street!,2020-08-17 00:23:14,0
164239,2wUdqYwLkjOIles2j6KFBA,S2Ho8yLxhKAa26pBAm6rxA,I absolutely love this place !! Food drink staff omg I'm here always,2021-11-01 18:24:33,0
164259,wTljfJQYy6tGuIVZvOFYvg,hyq0W0_Sc5PNyXBdxVki5g,It's actually a little cold sitting outside prepping for the GMAT.,2011-09-05 14:34:23,0
164536,S9_LlDbf9A0d7-Gcsd6H-A,NIQWO-Q_F598XlAvZnFVCA,Craft beer and the best whiskey selection in town.,2014-11-02 02:12:10,0
164725,pMOB-sWONLtGrHq-IMFWhw,GyC36Pn0Q1-qHnqXys6yFg,Too many old people.,2017-03-09 18:42:05,0
164772,cLv3F5Pu-FKjKgfBn9r3Zg,NIQWO-Q_F598XlAvZnFVCA,Burger time !,2014-01-23 06:06:11,0
164781,hV06Geenm4M9voCU1gJxng,Y1QKeVZSvhnAZnO26SK6QQ,Yummy! What else to say.........,2021-08-11 18:24:27,0
164782,aRkJGL9CemMp2E4kD41vxQ,NIQWO-Q_F598XlAvZnFVCA,Great location and good variety of food selections and lots of craft beers on tap! Nice mimosa and Bloody Mary deal on the weekend!,2020-01-04 21:30:18,0
164806,-5-MfVhQBEDN6gx-evmQLQ,0ByzGehS0T5muzZ2qYGq_Q,Food ALWAYS fresh to order so make sure you're okay to wait 10mins or order ahead,2017-04-01 19:41:59,0
164905,7rsv6mrLHgX0UuPghHH2_A,xh7mQ46QUMswpugKJFmppQ,"The food is great and the staff is awesome, especially Joe!",2020-07-02 17:27:12,0
164930,vOY2GYSC0yoMDvzxvxc2BA,ZCURd9PiH4qdEjQfrIZzFg,Maggie's. No Go.     I love it if u match me!!!,2012-09-30 03:42:27,0
164937,WtVmYZgC3b4sMxo2Yhawpw,WtUxi5n8KlQdfgHZfB2Fqw,Very good fried chicken and great prices,2019-02-10 20:07:03,0
165109,Abllp-JWd4nQXCPI0Z84vg,0hCrds3sgFAYzsZolg3jcg,Just finishing up,2011-06-26 16:23:11,0
165290,ic6B9qJFLBmCPUdy8Hosog,frsWe9bmMOMIBOBNzsCTew,Turns into an African/Caribbean dance Club on Weekends after 9pm,2017-11-27 18:31:34,0
165407,IjzwTlGC5pCcLeIVN51lKA,4gn3wNWbNK8vPfoCN_BKAA,This isy favorite spot for lunch before returning back to work. the food is always fresh.,2013-01-29 19:31:48,1
165487,LlIZmwJLnw7PMDktDiy6sw,4gn3wNWbNK8vPfoCN_BKAA,Craft 2 Menu,2011-03-16 17:38:21,0
165494,7z-Crwkwo3wyngtjFhdJ9A,OrE8LhQpKVXTA6gJyu5G9Q,Really hits the stop after a night of heavy drinking. Friendly and fast service ftw!,2013-04-27 19:01:29,0
165526,gP32Jhylx_ayUoprzTyimg,0ByzGehS0T5muzZ2qYGq_Q,The food was good.  It is a good place to eat.,2019-04-04 01:14:08,0
165545,0Nj5q2nD0AnZ0d1I0F2hwg,0sr1EyOc6Td1C-962QW88w,The tomato pie is fantastic.,2019-01-06 03:28:10,0
165554,Tl9uYhBOYBtoOjbVnxTpqw,2g1ZiT6cM1NC4nJ8xS6EGg,"Good food, fast service.",2020-08-09 17:01:51,0
165599,y6iuhF7oB3zKb7fUu3dS1g,qwOHMS_GcwDMY8z55_naUQ,Love this place,2019-03-30 21:54:01,0
165736,A_FuioCSVgYOWZCSt_eLvg,JUlsvVAvZvGHWFfkKm0nlg,Great drinks & great food !,2014-05-17 21:08:33,0
165761,ppZA9ortrjlrJBFz1TzATQ,lNsnmur2Df2oK9ywyY0H3g,"Great food, excellent service.  They have a nice vegetarian selection also.",2021-01-25 23:28:16,0
165774,I-kDntNSbhS8M9BOnMbWlg,3uvFklejzRPwEPEZQ5vHYQ,Wow wawa pops on Saturday night!,2013-05-12 02:32:12,0
165821,BcvBCZuYaLR71pkjyCNEzA,iq0qAJ2Oc3myUTTMLseTXA,"Their pizza is delicious. Sweeter sauce, not greasy and thin crust.",2018-06-14 19:18:41,0
165829,iJYUZVeCmSGs20Dl-PgXqQ,NIQWO-Q_F598XlAvZnFVCA,"Always good food great service
Huge selection and amazing HH!!",2019-02-13 08:06:57,0
165866,cRt0608EYB1iuKxbTg8h0A,_IDiMjAPem5GYRu087vLyQ,Check their website for drop-in offers.,2018-05-17 04:33:40,0
165897,XOLSxHbKm2V8lrvwuBFUSA,cSeA6pC9JUlGfz-RNfvnGw,"Good service, knowledgeable staff.",2020-10-14 01:38:40,0
165902,3fLu6K7fStK-sAt6-YlxLg,UTm85DD1C_GMNrDzJVT9nA,Always delicious food and very fast service. Never disappointed!!,2018-12-09 01:36:26,0
165988,BUuxF1V4sKJNajlFH-RQuQ,6U0ZweWWWQUzea2rF4zKgQ,"Good food , good prices, good size portions",2021-10-13 17:42:52,0
166023,j2zoTQlLqeaUZJ8Bn7OkDQ,OrE8LhQpKVXTA6gJyu5G9Q,"A spicy #8 or #48 for a delicious treat.... Love this place!! Also, the spring rolls are sooooo
fresh!",2014-07-28 07:25:50,0
166063,nnLWzrylrv17ZGDj2uc0Ow,Aphp-EdFass877c-sWp5eg,"Delious light, fluffy scrambled eggs. Great service.",2021-11-04 20:25:10,0
166071,cWPbIDJe1Iq0tE_rIdKEZg,iq0qAJ2Oc3myUTTMLseTXA,Best pizza in town,2019-08-21 23:19:03,0
166107,hNjGAeQ9csqYk_ntTIUbcQ,NIQWO-Q_F598XlAvZnFVCA,Park in the parking structure near by and take the elevator up. This place is on the west end of the shopping center,2019-10-12 22:18:58,0
166137,7BNjiVR2RWn_4b1Mu5Yr9w,A0Jeadkkxq63uP2r27_6fw,Not worth the money or my time the inspector very rude!! Not going back,2018-10-12 15:04:38,0
166154,RG3ZtPjFupR0x1UD6Y5qiw,0hCrds3sgFAYzsZolg3jcg,So much selection. Great customer service.,2020-01-02 16:59:13,0
166158,8Ee7tTXpInk5l10bdtij8g,FMbU3h5FKs1PCNYiQCqBWw,A,2021-04-09 22:42:01,0
166170,WQK9gguIXKZqosGgfdBrSg,7hpUoYdAVToZXwuPRgoqdA,"Current wifi password is ""november"" but I hear it changes. Just try it and ask if not.",2016-09-25 22:02:09,2
166295,Hi6z-YoEc55M1TJ-JYKaqw,NIQWO-Q_F598XlAvZnFVCA,Decent food. Bad service.,2018-07-01 21:58:23,0
166686,J8C43Z6_wkbnQ9SMd_rl1Q,P6SiaPYpbduSSKt6lOAkuA,"Great lunch, food was solid, Ashley was efficient and fun. Good spot",2017-10-05 18:02:18,0
166918,pLh0uRdYrWaLctPVg62unQ,NIQWO-Q_F598XlAvZnFVCA,My favorite place in sb probably! Trouffle fries and the pearl blues burger = THE BOMB!,2013-01-05 21:28:00,0
166944,Y4_Z0NAfup4fOqeHA9rM9Q,S2Ho8yLxhKAa26pBAm6rxA,Yummy food. The jamalaya and bread pudding was excellent.,2021-10-20 21:04:42,0
167057,dfbaXDj9M38FoXpqHCLjkw,FiPzoDUHkE-W7TdtyuBRBA,after the first snow I had to call them back the next year to repair the steps again because they've started coming apart they came out repair the steps again and the following year here it is now again they came apart 2018 my money was taken away from me and they refuse to return my calls I don't know what type of material they're using but the steps should not be breaking up beware of this company,2018-07-12 16:47:44,0
167131,Co-RlUT1xleYRJLiogSLNQ,NIQWO-Q_F598XlAvZnFVCA,The cowboy burger is my favorite!,2014-08-07 21:01:30,0
167167,yxvWUT49_oLx2JUeKTgvfQ,GlYN-RJyL_YwxIqsSDo1ag,Come early!,2014-07-27 14:47:22,0
167347,MC5Z3oelrd8im-823TZixg,QWqKTWQ2OiDgo3dzNkpung,The service was so poor it isn't worth coming back,2019-11-12 19:21:16,0
167440,yuoFO1gKNWdtB093Y7R9fQ,c_wrQJRAH478aAWJajPZ5g,I had the falafel sandwich and it was excellent.,2019-11-16 18:22:50,0
167502,VzQ9VwmW1NkOxcMD_ctU-Q,D7Os2-9ApTGmNyzidqfwGA,"Couples swedish massage was amazing! Relaxation lounge, sauna, and steam room, and free valet are nice perks!",2011-03-10 17:04:10,0
167557,h6CkTpfy2ng85F0cjVfSFA,S2Ho8yLxhKAa26pBAm6rxA,Robert I.  For your sake I hope you do correct the problem!!!   Good luck with that!,2019-06-14 22:20:58,0
167638,qtqvz37G4Ryxgx9SnQADyA,SbdL-8NSmTWgSwdGZBa7WQ,Fantastic Italian food!  Killer garlic bread!,2018-09-11 00:53:21,0
167659,0jy8toKFjMHGR4Rxk3LlAw,ygS0u9G_VUeV0nF-iVDRQg,Delicious in every way.,2019-02-17 18:07:53,0
167687,YSaYBzRTFqxxcObcE1Y6kg,_E0WPHfJEYmwOUCAj-Jq1A,Best part about this western village... The casino is beautiful!,2017-01-18 18:02:41,0
167693,6RYTcCxu48RwnvS5R72kKA,NIQWO-Q_F598XlAvZnFVCA,"We heard about this place & decided to treat my husband to lunch. I must say I was extremely disappointed. It took 15min to get our drinks. He was served his beer BEFORE I was served my flat coke. When our meals arrived 20min later, the mushrooms on my burger were cold and tasteless. I didn't receive mayo as requested. When I asked for a side, I was told they had to ""restock"" it. 15min later it came, but by that time my burger was cold along with my fries. We will not be returning. :(",2013-04-22 05:32:04,0
167695,8KpSFNW_BD6_UFxt2E71Kg,2myVMP_l-9f9JIZewm19Cg,Excellent water pressure in the shower,2013-08-03 22:16:07,0
167705,bOwg27eXT77kXu5mklxAww,sAl3Paa2co9Kw87UruMYEg,Hot breakfast from 6 to 10 am!,2015-10-18 14:33:34,0
167790,JtYnQ346WscYMIrbOXU5sw,xh7mQ46QUMswpugKJFmppQ,Maybe it's just me but it wasn't what I expected.,2021-08-14 17:51:55,0
167914,5-5H_HiOgrnKsv-bMzqeYw,GlYN-RJyL_YwxIqsSDo1ag,Excellent chorizo!,2014-03-09 16:39:04,0
167971,YUAjPgrluh4NmeAGJ8w6Hg,o2i4AvqF6Q9lWK-wksxzuw,Very good mahi-mahi with Orange sauce and noodles!! Also good the sea-weed salad!!,2018-05-09 00:24:56,0
168021,DwMRCl8ZPqhezwbzzoLRgA,6Z89Ixagyc0mrVnyZHiIVw,Ordered fish salad. Pathetic how little fish is given. Maybe 2 oz,2019-04-25 23:25:01,0
168034,DkrKZr_sWXTFl69qu_V4GA,nMxfEiAANa_FsrCZZVHoEg,Little dirty.,2020-08-18 20:18:43,0
168102,TFCgd-nQu6fh4PKGl3oBwg,rBE5TT_ndOOczNBrbRnJwA,"Awesome place, excellent food!",2011-12-28 03:49:56,0
168445,lhW22AtAir4yalnKlFYjmA,OrE8LhQpKVXTA6gJyu5G9Q,Someone should of told me that there is no HOT POT until 3:00,2011-10-12 20:03:31,0
168453,XZAlM9147CaoVn4g-SobUA,6Z89Ixagyc0mrVnyZHiIVw,Always delicious meal at Catch23!,2012-12-23 00:23:55,0
168825,qBPKS61W3nYguba7Pg7U9w,lNsnmur2Df2oK9ywyY0H3g,Excellent food and service!,2015-09-17 15:53:26,0
168830,XnonCQgGz4Sjnd7fZ5RCAw,JTp9ExD1G0LxUczA5mxXnA,1A - hot braised chicken boneless combo,2011-05-12 18:12:03,0
168886,LI-79W7tQEqEKJj00PB08g,H2nFgEFitRk7ltE8IRH0xA,"If I take the survey on my receipt, will the service really improve?",2012-06-12 17:42:13,0
168913,Q0q9iPdn_naIyPicaxcSag,ZCURd9PiH4qdEjQfrIZzFg,Love love love the huge granite bar. Great cocktails! Cute servers.,2012-08-04 01:13:01,0
168968,P2jWOomiJOGnI797qFZ8DQ,NQ01WqVX0tojNHKn-0sFww,New brekky menu with lo-cal eggs Benny,2011-01-22 14:12:55,0
168974,F7tLvUEV3aDtwZ7llHl6Rg,3SuFU8tr_RcfTqh2mGorjA,Great child dentistry,2012-05-24 19:43:44,0
169053,dEOM6dPe7JO_MLE2CxomRw,OrE8LhQpKVXTA6gJyu5G9Q,Fried salmon filet is YUMMY.,2012-02-03 23:34:30,0
169141,gRLeSD7hGecXiNrwX0Rq9w,GlYN-RJyL_YwxIqsSDo1ag,"If you haven't been here in a couple years, it's way different and better than ever.",2012-12-01 16:53:56,0
169178,p-PC4pkK0v3Z34EDOGLXmw,9D7dDnaZZglUOj75xFy-nw,I came in for a quick pedicure and they were pretty fast!,2012-05-18 03:47:53,0
169185,nT45X7F7-wOLgyMTm5mA1w,o2i4AvqF6Q9lWK-wksxzuw,Avoid at all costs - the seafood at this one is gritty and simply not good. The key lime pie was one of the worst I have ever had.,2012-06-14 10:13:46,0
169186,GXACXt2hMnTmT_dSMHTBTA,fNfnyVFfn7B9zuU7cYyk3Q,You can park in the Cal Neva for free so long as there isn't a special event (i.e. an Aces Baseball game). You can also park in front of the post office on the north side of the Pioneer for free after 5 on weekdays.,2016-06-07 16:36:36,0
169267,RsdXpU75r3VHIbfaVIwTiw,lNsnmur2Df2oK9ywyY0H3g,Excellent meal and service - red snapper was amazing!!!,2016-04-17 22:47:02,0
169298,dWmLU_mAhcA9jQCD5n8g-A,JUlsvVAvZvGHWFfkKm0nlg,Great food and drinks,2013-09-01 02:06:17,0
169329,XbdEa2KSBYnVYJXvR9EhOA,J_K_rgs3xZJkd3zAX1JxMw,"Watch out! Unless you want bread, mayo, lettuce, I onions, and two pieces of meat and cheese for $9, it's probably best you go to (the awesome) Potbelly across the street!",2017-04-03 09:05:46,0
169338,P54G_aFMxcke6l9fqxYqnA,8QUOYn1ehCU0ixSWE08RIA,"NNot impressed at all.  First time going to Jack in the Box.  Food was average @the best, just another burger joint whose birgers simply are not good.  If they gave me a burger for free I wouldn't eat it ! AWFUL.",2012-11-30 19:47:49,0
169584,lNZl2JhzHPaeuwH1AoRxLA,o2i4AvqF6Q9lWK-wksxzuw,Can't beat the Chowder & the Crab Cakes - wow!,2012-01-17 00:12:38,0
169617,uKlzUuusUZHCVnrcU0vA3g,QkyEr9j7il9lJqseTbPe5w,Excellent zuppa di pesce special.,2014-09-26 23:39:06,0
169622,XJqzrjNRsfI0-I9bSI75PQ,OrE8LhQpKVXTA6gJyu5G9Q,Ranks #1 for pho in Reno at least by my standards.,2010-12-20 20:15:42,0
169630,gRLeSD7hGecXiNrwX0Rq9w,GlYN-RJyL_YwxIqsSDo1ag,French toast like a mofo.,2013-03-03 17:11:15,0
169735,MxEU8pOa1CcNfzmo3mRp8w,JUlsvVAvZvGHWFfkKm0nlg,Fucking love this place. Food & drinks are great. That is all.,2016-09-11 01:25:53,0
169823,P2jWOomiJOGnI797qFZ8DQ,NQ01WqVX0tojNHKn-0sFww,"Michael tending bar on Sa'day morn, foot'y on the big screen behind...",2011-10-29 11:56:06,0
169838,LI-79W7tQEqEKJj00PB08g,H2nFgEFitRk7ltE8IRH0xA,Beefy nacho burrito!,2012-06-04 17:37:58,0
169868,M7Tus1MRsXvyA_tzSkyx5Q,VK7m9w-wi46_LAXKshk8cg,Worst service!!! The owner is ridiculous,2016-09-16 22:57:20,0
169888,ChX8SnZ-tRRlkPgiC2tz-g,cN4Y09a7clgjFd1tY-wSZw,Been sitting here for 15 mins and no server.... Patiently waiting. This place is a shit hole already.,2015-01-20 23:53:58,0
169940,JnKAvb2k1q2jezkacGnT2Q,NQ01WqVX0tojNHKn-0sFww,Great food. Great beer selection.  Great service. Roaches in the bathroom ew,2015-06-24 00:31:41,0
170032,qcyELeKglb06BRbdXVCcXA,kLG2-BOk3YHDXS8PCxekZA,They lie!,2010-04-25 06:54:04,0
170034,IQ04YhmDqqBYL3P80u87sA,7hpUoYdAVToZXwuPRgoqdA,"Good coffee, great atmosphere.",2015-09-10 18:39:57,0
170053,8YdXhxPdiRAXmqNM_i3eNQ,S2Ho8yLxhKAa26pBAm6rxA,Awesome place to eat!,2017-07-12 09:47:53,0
170090,a83hitik1z2mawahuJvbWw,UTm85DD1C_GMNrDzJVT9nA,"Delicious. 
Consistent. 
Fast.",2016-09-08 23:23:53,0
170142,fpPNXUbhJyqxrupiJJrJpw,JUlsvVAvZvGHWFfkKm0nlg,"Amazing food and affordable, must try the piña colada!",2011-05-12 01:18:25,0
