,user_id,business_id,text,date,compliment_count
52039,QmOBo3f9F65o-Kn9tSQUtQ,Nemb9iLSuFgHsU6Rv8Y1Tg,Ordered buggers and they totally f ____   ked up the order will never return,2017-12-10 00:55:42,0
52086,RVALk-GeKd504Ci-vGSTrw,Tm3QiAVLJAR2fEJK7APPPQ,Pre-work out and then a little mid-day Zumba.,2012-05-31 15:58:56,0
52108,JmN0ZSfVzwiY1dBhKF9Uxg,iBRXLFWD7PeSYDbKsd_JTw,Go to place for Pad Thai. You're welcome!,2015-09-21 15:02:25,0
52216,dQDt0l5e9sre54eG7plUdA,gLPlHz4xHajEWqQ88w8_tg,Had a tire low on air and the pump didn't work staff was helpful though.  Beware of this air pump had to go to the Wawa up Lewis road,2013-12-30 12:38:17,0
52284,rAgCPqxaQKgd7XQVhePBeA,JUlsvVAvZvGHWFfkKm0nlg,"Attn vegetarians: Anything on the menu can be made with seitan!!!  Vegans: options for you, too!",2017-12-10 19:37:16,0
52295,4bVNp8dGyzQLi9FLPiF-Nw,2g1ZiT6cM1NC4nJ8xS6EGg,Have to wait for a table,2011-01-13 01:35:19,0
52332,b-VoDOOHRKLd-w9Oyb2JYg,NIQWO-Q_F598XlAvZnFVCA,Free app with check in!,2013-09-03 03:34:45,0
52486,3ooUUYdui0xhJLJCkINaPw,S2Ho8yLxhKAa26pBAm6rxA,Cheesy Garlic Bacon Oysters. Do it.,2016-04-07 03:18:57,0
52556,_0u86uCYwst3NvSKsKjodg,G_gkdBVK8N5Sp9CSGnYeMw,"Great service, great food.",2013-02-11 21:44:22,0
52557,P-Fv4Mm56a2wTEsA34JMew,dIpTuL2T1L98GQGU17IeSw,Happy hour all day on Mondays!,2012-06-05 00:16:49,0
52587,FWlH_dZUgi9xAdjAZNIUhg,A0F-h3xJm_6gHDKcDQwSrQ,Sample the gelatos before getting them. It's $7.25 for 4 flavors so take advantage of it!,2014-01-12 21:13:59,0
52604,vbii4mRfJT7H04MnkhCo2Q,hYonVJe6xzVBHHT2FLo4zg,Lively crowd good world cup beer specials and plenty of TV's,2014-06-19 01:57:09,0
52676,EKE59c8eXD9wDGBsBKLEQQ,JUlsvVAvZvGHWFfkKm0nlg,A favorite spot of mine. The tacos & margaritas are great.,2016-09-02 23:02:24,0
52791,VI51-sio82ukYs9WfwfR1Q,APW4-ESYGTIn17mY189Osg,Kick n crap soup again and Asian lettuce wrap yum get in my belly!,2013-05-31 19:16:40,0
52800,eqI5C_dFwwcrUgB6q6Z6xQ,kLG2-BOk3YHDXS8PCxekZA,Over active door shrimp. Calm down some.,2013-06-04 09:07:45,0
52868,1dQiuUvvK8427TBmqj_4Vg,UX3eq0WsVva-cqlVrzyzFg,Finally found iced tea at the rib cook off!! $2.69 f for a giant to-go cup,2012-09-02 19:47:44,0
52890,Dh6OTRg1ajZ6QLZgbOTcBQ,g_nLH7QGP3_l1eE-7JWhwA,"Parked at the river walk on s sierra today, across the court house (Island).",2016-01-28 20:42:07,0
53019,eMHDd029OvjzUhtFPxr5iw,QXJR1j949PHnH9ImB6xUcA,Now offering free WiFi....the connection is quite good as well!,2014-10-23 16:27:16,0
53020,YyuHjcBrRv2cOzQL1PK9vQ,JUlsvVAvZvGHWFfkKm0nlg,Awesome margaritas!,2012-10-12 23:49:13,0
53051,6HrtB8w2qXtJVXyKt9wa7Q,_IDiMjAPem5GYRu087vLyQ,"The Ass, arms, and abs class kicked all three of mine tonight!;) amazing workout",2014-07-11 01:27:32,0
53060,lt1ly1nymX6eWBsbAoyzDg,zDJoyeohHjEX-Pz6zQfPng,Closed :(,2014-08-02 23:26:32,0
53084,bT2d5Uglz1RmzvbBm5bawA,JUlsvVAvZvGHWFfkKm0nlg,"tuna tacos were great, service still stinks here.",2013-10-06 22:11:11,0
53096,bPwSdACtD1AjQ70fk5Zy-Q,NQ01WqVX0tojNHKn-0sFww,Good beer selection and that's about it. Oh and great location but not my kinda pub.,2013-10-09 00:51:21,0
53123,wAgg_B9OQzL8_UF8ozu1eQ,283P7ZbkvsHfhZTQX5m96w,I find their coffee much sweeter that I remember in Michigan.  Taste it before you add anything to it.  I am not sure it is as good!?!,2016-10-11 13:24:37,0
53165,MfJkJhp0QLbavUJYz3rlLg,Nj7KMzoaGQ-MTAtqToMCLQ,Delivery costs a dollar. Can't get more convenient than that!!,2012-01-16 18:02:58,0
53246,8A_aZ7fWSJPKtr7N4xJFSw,UsGnKwfJC1OEyOjcxuUY9A,I,2018-06-28 23:26:11,0
53258,iiu3bqTQyXy2Eu-jzO0T2Q,JUlsvVAvZvGHWFfkKm0nlg,much better,2011-01-08 03:56:07,0
53492,jhB1bKLZ5MMgono_xvsfcQ,UX3eq0WsVva-cqlVrzyzFg,Never come here. She brought us a seafood mexicana instead of the seafood quesadilla that we asked for with no olives... she put in olives..,2011-06-27 04:24:48,0
53534,Wme_XX7CkO7hv8H2SPMWlw,4RMHlggaIdNibPUJPVEd6w,Elysian Jasmine IPA on tap,2011-10-04 20:50:34,0
53543,G3h8pIclwUbuu3itJqF7ug,aJpDjaMVhWZRLdwZtqQjEg,Come in for the rice crispy square of the day!!,2013-04-11 19:43:51,0
53547,IRc32xCXlHDQjezcG5jj2Q,GlYN-RJyL_YwxIqsSDo1ag,"Summer hours don't line up with Google hours. Closed Tuesday, Wednesday, Thursday",2016-07-12 16:01:32,0
53582,X0mvQzh4rPt8Jz8icRHkgg,7UizgaT567svtdEXvD6Zfg,"Lovely salon with an array of services.
Had an hour massage with Brittney.   Wonderful hands and she was kind and thorough",2016-03-27 18:23:39,0
53593,jFSrZYDK85AM4Yhrbg99kg,NV6zZPb5OGVpyX4JrSzUPg,Inattentive service coupled with mediocre food and OK drinks.,2017-07-29 04:48:24,0
53784,ioDTSZBmkfOpYohkekzPGw,9oAvfXfwbjiYzSiTs1preA,Crepe cooking class,2012-03-03 15:59:47,0
53805,RMxvK_J_Pn3qWUxug8-8zw,GMjmrbksSxabPHYmhjsOEw,This place has the best prices on guns in Hillsborough County. Love my new sig sauer,2014-01-18 19:39:33,0
53820,YjXVvKg1BadFf3dR9BZsSw,kWrn-inIIahiSFWft-13qQ,"Amazing food, superb service. Highly recommend.",2017-10-07 11:48:11,0
54146,lMY8NBPyzlPbbu-KBYfD9A,FMbU3h5FKs1PCNYiQCqBWw,Replace the service receptionist. Otherwise the service gentlemen are all great & waiting area awesomely comfty,2011-11-29 17:36:40,0
54218,3K6tBpPs2D4PbUAGfP863w,7hpUoYdAVToZXwuPRgoqdA,The coffees we got were very very bland. Nice service though.,2016-04-03 18:09:41,0
54386,wLFuvZ59HGUJZ3QBgqlmAg,r43DrfYAbAgifsYyNkljZw,They have good bands but don't do enough to promote them. Call ahead to find out what bands are playing.,2017-11-12 02:51:47,0
54429,vUiebV27kFKne70hRP-L4A,cN4Y09a7clgjFd1tY-wSZw,Pablorita pitcher. Yes please!,2013-01-15 00:41:52,0
54515,bU1fuETEHDrUS6PI9eA07Q,4RMHlggaIdNibPUJPVEd6w,It's usually pretty crowded but be patient. It's all folks waiting for their trains!,2014-01-24 21:53:48,0
54600,8H7JSwwFILh_gMAGAUSryg,5EGhvgDt_E-JPl4EhQkOtg,Buy the refillable ceramic mug.  It's worth it.,2012-05-03 19:32:45,0
54674,ixp_GP-jOwLr_RBfR1T9xg,SbdL-8NSmTWgSwdGZBa7WQ,LOVE this place.  I always get the wings with anything I order!!,2017-05-11 13:38:55,0
54849,3dZm12lNAnuBVfWvwRAxTA,4gn3wNWbNK8vPfoCN_BKAA,Bangin burrito,2011-10-14 16:29:12,0
54898,EIt66bYmFr_2kbs5qsL-0Q,6wTfR9l9g9vwpDqYF3xFBw,"Filled the car with laundry to where I couldn't hardly see out, and spent $15.50 to start the washers. Much better than doing it all at the few machines back home, though!",2012-06-30 23:50:21,0
54911,-G7Zkl1wIWBBmD0KRy_sCw,vPcfJ3rm3NpdqVDod2WxLA,"Aviso: Unless this is the last place on Earth, go elsewhere.",2014-01-07 22:17:34,0
54920,gfYlHBOcg6mTKfGkAx3WqQ,S2Ho8yLxhKAa26pBAm6rxA,"Food isn't all that great there. Also, the drinks aren't good.",2016-12-03 21:58:58,0
54955,yA7JDY9WPzfah1pRp8Z0Gw,QWqKTWQ2OiDgo3dzNkpung,I love this place,2014-05-05 23:10:18,0
54994,uweSiVXeDAibh-I7xOZwEg,7UizgaT567svtdEXvD6Zfg,"If you've never had a massage but are curious,  ask for Michelle!  She is so wonderful and professional.",2014-04-30 00:44:44,0
55108,VciG4cP9hKJSu9wHELMnHQ,JUlsvVAvZvGHWFfkKm0nlg,This place is pretty good... Strange menu but the food is good and portions are grande...,2010-12-19 00:39:44,0
55205,eMHDd029OvjzUhtFPxr5iw,QXJR1j949PHnH9ImB6xUcA,David's Tea is now open next to the security office!,2015-04-03 23:00:17,0
55225,-X1DtcndHvtoFkVsZZLsFg,Aphp-EdFass877c-sWp5eg,"Tried the veggie burger and substituted the side to fries, and it was moist and delicious! Highly recommend it!",2013-07-19 15:15:51,0
55321,ikWD8meznb14w9yNie3bwQ,EYI8_RsZyfu8x6lYgvc-2w,"Complete paperwork online & show up. No appt. needed, but you can make them. Insurance filed.",2014-08-12 14:54:21,0
55372,XpnTnUz9fgHnfvwTGL6a4A,ostgbmaf36hOicxyl71sPg,Best in blackwood,2018-06-22 12:12:07,0
55375,scMLUgV1SzTe9TjBBuf3tg,D7Os2-9ApTGmNyzidqfwGA,book a facial.... the peels will leave your skin looking AMAZING. my skin never looked better!,2014-11-03 01:00:47,0
55467,Z_6YFEn6wEOJRcRDB_Rglg,OrE8LhQpKVXTA6gJyu5G9Q,They now have a full service bar!,2011-09-02 01:38:02,0
55471,ZCbJ-QFRIMfqJQv9XG4XcA,A0F-h3xJm_6gHDKcDQwSrQ,Candied hazelnut and super dark chocolate are by far the best. All the others are good but you mostly taste sugar... Way too expensive and unhealthy to consume on a regular basis.,2015-04-02 19:41:25,0
55586,wdNTfRMdKZqpOo1G4YJGbA,MuJBELBk9VXJjH0tryDh1w,Taco Tuesday is awesome!!  Love this place!,2016-12-20 19:09:38,0
55604,cQi5KWvQ3cbWqWTTwa7fxQ,zUJMvjK6aBeQtVCowZ85-w,$10 dinner now compare to $14 because of competition,2018-06-08 16:44:34,0
55693,YjS6MDNwGbueb5WtALIJ2A,w7jVSNaeWrFHhUM36rhlSw,Love this place. Very personable and helpful,2012-10-18 00:21:38,0
55846,t0t4XNPtitNdgJv9UbfJgQ,6Ua4Pu_2bXuxpaxDyUA_BQ,Great food! Better staff!,2013-01-05 04:34:04,0
55914,6IU2dlj4A9IesaQDEDrHXQ,UX3eq0WsVva-cqlVrzyzFg,Get the mesquite pork burrito. It's amazing!!!,2013-05-02 19:56:19,0
56037,j0vJZm7cqSGMx_YqScMY8w,JUlsvVAvZvGHWFfkKm0nlg,Margarita Pitchers!,2011-04-30 04:35:44,0
56052,8MSZucmE47kH1av66SO_XA,c6GTImF01z981_BNJIye2g,Guess what couple is in town?!?,2011-05-13 22:35:26,0
56075,110pflSC-iEVhRjPZKxhBw,iBRXLFWD7PeSYDbKsd_JTw,Love this place. Why go anywhere else when you find the right Thai restaurant.,2014-05-23 23:03:56,0
56126,5a5tpKfJpv4XVb66v9UZbQ,0sr1EyOc6Td1C-962QW88w,Worst delivery ever,2017-03-04 23:02:58,0
56221,xNuunm-8T2F513gkU2iA3A,NQ01WqVX0tojNHKn-0sFww,Great for pre-concert pit stops!,2012-07-14 21:36:44,0
56243,PnxFcgo1dEDOzx7QFSCSPw,ppFCk9aQkM338Rgwpl2F5A,"When I was a freshman, sophomore and junior at university, wawa was the place to get food at any time if the day. It was fairly cheap too! The 10 inch sub is the favorite for all college kids you can get almost any toppings you want. Even if it looks crazy crowded they are quick making your sandwich !",2013-09-05 23:37:16,0
56261,_p9_GXbJNUJLkieaOFfhHg,4gn3wNWbNK8vPfoCN_BKAA,Guacamole is amazing!!!! Queso is a freakin' must !!!!,2019-05-06 22:31:59,0
56287,UMmYgHGIS3orW4MEEEbsqA,GyC36Pn0Q1-qHnqXys6yFg,The food was okay and the service was okay. Nothing special. Good for when you're too lazy to make your own traditional American breakfast.,2013-03-14 08:26:02,0
56333,tgsU2AYnlpa2mSYpD44OPQ,QXJR1j949PHnH9ImB6xUcA,Wetzel's Pretzels to open soon at the food court.,2018-03-07 22:19:11,0
56360,JriXL8qqw_tJ1mpwtlBabg,5cz1XbgalpQ89gsNQwneVQ,Great food..yummy..plus we love the service,2017-11-17 03:13:52,0
56502,EYDmZ4e8b_zu-zfe7eiQBA,rBE5TT_ndOOczNBrbRnJwA,I'm on modified paleo still can enjoy this place!,2018-02-25 23:04:37,0
56541,hQnjE5ACXjrquVkI_XVe4A,Wc-c_hQK4vFCl9keeVTUZw,Get the catch of the day blackened not fried.,2019-04-16 00:13:24,0
56557,ZXWyMyzFTdor6bh9d0qN1A,7hpUoYdAVToZXwuPRgoqdA,Now serving sandwiches! Euro grilled cheese was delicious,2016-11-26 21:04:29,0
56558,ayh-p9OVESQaF_RZH_RHRw,QWqKTWQ2OiDgo3dzNkpung,Soft tofu mushroom soup and vege-jap chae.,2015-06-18 21:50:30,0
56579,7Na1pUcEv3oF_QTRwZ-2iw,9D7dDnaZZglUOj75xFy-nw,Pedicure :),2012-07-04 21:44:41,0
56613,MHOOd7OdaBy7JUZ7bcJ09w,GyC36Pn0Q1-qHnqXys6yFg,Chocolate Coca Cola Cake!,2010-08-31 23:33:18,0
56667,w5iiF7drL4mKBBO8oAUQqg,QWqKTWQ2OiDgo3dzNkpung,I crave the oyster soondubu. No kidding!!,2016-02-20 06:41:22,0
56774,DnvC-m22fZqZv3pAo16ZSg,c8rjE6NcfeyzLB_aU1GdMA,THE BEST french onion soup.  And the awesome fries... Not a misnomer.  The cheesesteak eggs rolls are delish!,2013-01-24 22:50:24,0
56874,jsaN4TDygu76AGTiB3PpBA,yuW60QyweNNcyHa_3fkrYA,This place sucks ass. Better off eating seven-11 hotdogs.,2013-08-25 14:59:02,0
57019,WHuuz1Xm8zkrUl8fAd31Eg,UX3eq0WsVva-cqlVrzyzFg,"Make sure to head to Costco and get the gift card. $100 value for $50. So that's basically 50% off. This place is really overpriced, 50% off makes it an average price meal!!!!",2019-12-29 04:09:29,0
57064,bfpdkDQfWjWoJRAsbtfATQ,buhO8vRCaEoNvlxU0AJRpQ,I think the iced lemon pound cake has to be my favorite sweet here. It's so light and fluffy and the perfect amount of lemony tartness!,2017-02-07 13:50:49,0
57095,6LpOxZB_ObAji05UFucQhA,oY5LFo6Yxxf32ePna6mEUQ,Bring your favorite at home spa gear and a shower caddy.,2014-04-07 01:24:16,0
57137,I6cqTgHlQHV0uYDzFOUlpw,utZYBTk8PovIJTad7Wm-dg,Try the key west pink shrimp.  Amazing,2021-07-24 19:45:58,0
57155,HPrE_5MppB97IYJaFOzcfg,t6gPcWX0CGkMR0AM1lCazw,Amazing food and clean!,2021-03-25 15:48:54,0
57404,IlRPJq1xQYVveMP-429-uw,6Z89Ixagyc0mrVnyZHiIVw,$3.99 burger night,2013-05-27 22:57:41,0
57497,aHDNyIn1LpGdylGNR_qXHg,N1uwt31mfmj5CXX2PwjTRg,Great service! Very professional and nice! I will be returning!,2018-10-10 20:38:02,0
57527,vALpp2IgoeeyiRoH1qRMuQ,bN7KQSVbEmRVJnQEkl3vkw,Made to order just like Salem's. Wait at least 5 min at drive thru.,2014-10-04 23:03:27,0
57596,lMY8NBPyzlPbbu-KBYfD9A,UM6XgOtTX4DWWcGDTWtjEg,Take note:,2016-03-16 02:42:51,0
57730,rhoYpRGBpyVeNngJgIzy3g,hYonVJe6xzVBHHT2FLo4zg,10% gratuity automatically added to all take out orders,2022-01-15 08:32:00,0
57768,fpLDYV0GdGEgu-CNeGUIIw,QWqKTWQ2OiDgo3dzNkpung,Great food and service. Will visit again!,2015-05-30 17:36:00,0
57810,hTAnTUL_uVEmpPKNb8ircA,GlYN-RJyL_YwxIqsSDo1ag,"I've been from Tucson to Tucumcari, the breakfast, and I'm willin to eat here often.",2013-06-02 15:59:52,0
57815,urlqwP8MH8SPsxEbl-owrA,vrQCClTDrPSbIHO-ub8qFg,"They have a lunch special that can't be beat. Half chicken, 2 sides, and a can of soda for $12.50",2019-03-06 18:24:25,0
57836,ipg6eNxagm0xbljbbpKdSg,JUlsvVAvZvGHWFfkKm0nlg,Great food !!! love the strawberry margaritas,2011-08-10 20:42:27,0
58029,t0t4XNPtitNdgJv9UbfJgQ,6Ua4Pu_2bXuxpaxDyUA_BQ,For gods sake come see this Greek god bar tender!,2013-03-30 23:49:43,0
58044,JQXuHs2bpz6xZa-HrCZ4PQ,d8tLbQ9o3aVdOLgueJtYXw,Love the speedy service coffee carafe on the table. Clock set to Newfoundland time !,2011-10-11 16:00:30,0
58066,m3UiLdOoU7gCqzvP52cMlw,lNsnmur2Df2oK9ywyY0H3g,Go with the nacho appetizer with chicken! The real deal!,2013-11-16 23:59:43,0
58131,_uXsvqMJYALJLaP0DaCWsw,x8joRxn_TPorP1C2LSdSYg,New address: 6424 Castor Ave Philadelphia PA 19149,2019-08-08 04:53:15,0
58150,Tk_5PpYiESYyyO2xrffukQ,xIz9cCuddNbDUcItCo5V0g,Awesome sangria!,2012-07-29 21:58:42,0
58281,JqidMr7mG4HKrieuoBeSVg,2g1ZiT6cM1NC4nJ8xS6EGg,The hours shown on Yelp are not correct so they may be open when the app says closed - call first :),2013-08-19 19:01:44,0
58328,8O5tGAz_LFuX3JTim7Egyg,FlWCsBiNoI4XTwZD8f_q0Q,"Amazing pizza! The dough tastes fresh, plenty of cheese, beer and wine available.",2011-03-03 02:53:05,0
58407,wLFuvZ59HGUJZ3QBgqlmAg,r43DrfYAbAgifsYyNkljZw,Excellent music and never a cover.,2017-03-25 02:13:58,0
58494,DMcuWA_bRjC7kqFNEjU7HA,dIpTuL2T1L98GQGU17IeSw,"It sucks, don't go!!!!!!!!!!!!!!!!!!!!!!!!!!!!!!!!!!!!!!!!!!!!",2016-03-07 02:53:00,0
58521,4CpzdtXiYxve0fIFWQBlIw,Ea2hPSFazxXITET4f6ZJhw,A regular Lutz staple for quick order foods. First time checkin with Yelp with a 2 year experience without yelp.,2014-05-23 18:53:01,0
58594,c4gjYdd3u8vc8eE63xyCpA,utZYBTk8PovIJTad7Wm-dg,"If bison, ostrich, wild boar, venison, rabbit and other hard-to-find meats are what you're after then stop in and take a look/see.",2021-10-31 00:43:58,0
58598,Rq0vsZxNpLnkWqjc7ACzrw,JUlsvVAvZvGHWFfkKm0nlg,Jalapeño Margarita is unreal!,2012-07-25 03:27:02,0
58629,oxd8luK8evai06xjyve3LQ,QWqKTWQ2OiDgo3dzNkpung,The kimchi soondubu is my go-to.,2015-06-02 17:07:50,0
58665,cQ4vjLfbzl7tMGc4M8Cd8w,MuJBELBk9VXJjH0tryDh1w,"Food made with love and care!
Love every bite of it.
A Must in New Orleans!",2019-02-02 20:24:56,0
58696,DMcuWA_bRjC7kqFNEjU7HA,dIpTuL2T1L98GQGU17IeSw,Good drinks great food good music higher class people and always something new,2014-06-15 22:04:10,0
58710,F2btBeGFsXzD5bHbvNV_2g,xa6JYHDgVza7CuenKBJBHw,outstanding chicken tacos.  get a handful!,2017-09-19 13:52:10,0
58834,179PX3j-We5Cvwl3SAeYvg,0sr1EyOc6Td1C-962QW88w,Great pizza and salads!!!,2020-04-04 02:34:49,0
58872,ChL9bGu27OlUkKKQe--kbA,7hpUoYdAVToZXwuPRgoqdA,50¢ refills.,2011-10-05 12:26:19,0
58960,u-grvSKFOHjHYAQGjNFukA,buhO8vRCaEoNvlxU0AJRpQ,Friendliest staff of any Starbucks!,2011-11-17 01:14:30,0
58967,gCduRMQlU604iFpU9HHMUg,GlYN-RJyL_YwxIqsSDo1ag,"Don't underestimate their buckwheat coconut waffles! Fluffy, light, and gluten-free!  For even healthier sweetness ask for honey instead of syrup! :)",2014-02-02 18:06:10,0
59017,pQNAhDZAfnw1Jp5K8NTGHw,S2Ho8yLxhKAa26pBAm6rxA,The pecan cobbler is a must-have if you have a sweet tooth!,2016-01-24 20:22:10,0
59074,7uImU07iGJJYRqvbpt5XPQ,JEHLdDbFMS1tEMSgaKfJxA,Military discount w/ID,2016-03-19 01:02:53,0
59187,mK3C8PnH4zk146VaveW3pg,NIQWO-Q_F598XlAvZnFVCA,"Terrence absolutely KILLED IT as our server this evening.  Very attentive even though the place was packed.  Best service I have ever had at Eureka for sure, and best service I have had period in a while.",2014-03-15 04:56:17,0
59198,saQQmDQQJ14BVkm_sg53UA,rBE5TT_ndOOczNBrbRnJwA,Roast beef focaccia panini is awesome and huge!,2012-12-23 17:41:00,0
59220,dgGUKdOh2a01OwLw1qgfDw,pVfazuriRESVBqzrGmOohw,"Lots of tees, magnets and mugs but not friendly! I pulled out my iPhone to get a picture of the shop and a girl working there promptly said ""no pictures!""",2013-08-19 03:11:47,0
59306,b4hKq2XFGFTQiI3Qj26W2A,OrE8LhQpKVXTA6gJyu5G9Q,Order the tofu spring rolls first thing so they can make them fresh 15-20 min wait for them,2018-12-24 19:40:49,0
59446,sqoyMvaTCWyTuLzZexoOjg,US2-dEVvnOdde7Syi18TTw,Try the Smokehouse Cheeseburger!,2019-01-10 00:40:33,0
59483,fSR8LJJ0Aa3w8HoaGyXYCA,YhQAQhG1IkXJH7oLZMbM9w,Fast and yummy fries,2013-08-10 21:12:15,0
59615,Xlb-Hxrvkfyadnkmk5hrgw,c6GTImF01z981_BNJIye2g,Big Green Egg Goodness!,2011-10-29 20:12:18,0
59733,MPyaSerLWlxdr_ZwEwZz6A,JEHLdDbFMS1tEMSgaKfJxA,All veggie sides are pretty much a salt lick with a ton of pepper,2016-07-08 20:22:01,0
59761,--WLSCJPoCNQmTmG2yPAcQ,4vLJd8N3wy_Q_wu_DZuRag,"Call ahead, they close whenever it pleases them.",2016-11-19 20:20:37,0
59770,rohwiags-kVO_IgYK1sIfw,kex3ujGWOUvBX_ms4Etdtw,So much hoagie goodness here!,2014-04-07 15:25:46,0
59789,FlXBpK_YZxLo27jcMdII1w,JUlsvVAvZvGHWFfkKm0nlg,I'm hating the covid set up tbh. 15% up charge AND you have to get your own drinks AND drinks are cash only,2020-09-21 00:24:13,0
59844,oQJKOyw_K3ZsKJj0iA3LLQ,US2-dEVvnOdde7Syi18TTw,"Always really good, garlic fries, shrimp pita, French onion soup",2018-08-17 17:37:42,0
59890,KzEJgWIpWeuUQHu38w1PLw,ZCURd9PiH4qdEjQfrIZzFg,Eat outside if nice enough! Great for people watching.,2013-02-17 07:27:15,0
59915,2TomydNdGcK79gqcWfnuSQ,NQ01WqVX0tojNHKn-0sFww,NICE beer selection!!,2013-06-26 03:52:09,0
59943,cOlCrJAz8AvlXcthKJXlsQ,CANuOWl6Z4soWkK2_1NWcw,Terrible experience.,2018-07-21 02:49:18,0
59961,-G7Zkl1wIWBBmD0KRy_sCw,cl5NjtALgaX7E-WL2DtiYQ,"Look for the Grand Opening of their cafe in Langhorne, coming soon!",2021-11-28 20:47:07,0
59964,lAW03ccfMEuRZiDqvVgc0w,MaLSzk58NOID1CSLjHH45g,Be sure to ask about their costume room upstairs!,2013-01-08 18:59:12,0
59972,Hn459lDU-IXEVZdNMQwIAw,vrQCClTDrPSbIHO-ub8qFg,"Quick, it's like a Mexican Boston Market lol, but 100 times better",2016-07-02 23:14:10,0
60051,MM4PsWm5OrkdhFrGKQxgnA,eaVcAlPmz-3C2ICy4zqbfw,"Always a great experience, with a perfect haircut.  Thanks to Sasha!",2017-10-26 15:50:02,0
60089,IJVqc_5NmUflKafvFyKqmQ,VBWUdluhRQf5kqawykM6Nw,"Nice little place. Good food, friendly staff.",2019-02-14 17:13:12,0
60197,UDTgDAoM1UmLxvmoEMj96A,KkpAwKzn5olmxH2K2GauNw,Such amazing pizza!!! Can't wait to come back.,2017-07-14 00:37:30,0
60219,Um5bfs5DH6eizgjH3xZsvg,3tX0CduxNIHgrxr6Toairw,Employee when asked for assistance looked exasperated. Knew they carried said item.. Hand waived and walked away.,2016-07-30 22:42:25,0
60286,l1_mbpLEo9-r5n5WMAwfBA,xIz9cCuddNbDUcItCo5V0g,Food is pretty good just don't order the steak!! They are thin and over cooked!,2015-11-29 02:31:27,0
60377,gr528N9hWldCgfKp99zWKw,4RMHlggaIdNibPUJPVEd6w,Great place; make sure you tip well! Bar/wait staff is waaay underpaid for how awesome they are!,2012-07-18 20:34:41,0
60459,pND8oNQvahOdQKkK1d2xbA,frsWe9bmMOMIBOBNzsCTew,Best place to get authentic African food !,2018-01-30 23:12:56,0
60516,cJILtxSTmkQTSO5CAjuOKw,OrE8LhQpKVXTA6gJyu5G9Q,#48!,2014-02-04 21:28:39,0
60535,e77XCYzv0ZCVxJvyrgxyhQ,rBE5TT_ndOOczNBrbRnJwA,Love this place. Salads are great and my favorite is the tomato and basil panini.,2016-05-06 20:13:59,0
60553,VGtpJTsM8H6G1-HucrsVuA,hF-Ndu77yzspMkDZv9bWzg,Order ahead and take out. Little dining space,2015-12-10 17:15:04,0
60567,hiIbTTTFZicxxGRYfJVTfw,cN4Y09a7clgjFd1tY-wSZw,Mexican food,2013-04-16 21:19:43,0
60621,2GdKEMhXh7xeFXB7cZRsDQ,6Z89Ixagyc0mrVnyZHiIVw,$3 sushi rolls on Tuesday!,2013-06-05 00:07:03,0
60634,-FxsSuwDbIII7yo5BjHpiA,jAGzl-N2GINB_wK87bjoVA,"On the 3 taco plate, you can mix and match steak,  chicken,  or pastor.",2016-07-13 22:54:06,0
60696,O8IWwp7nOHDt7b17KBll9w,tUhPRgJ7mBx-1fGef7Nv3w,"Excellent food, kid friendly, quick service and delicious!",2017-03-22 00:37:56,0
60756,wLFuvZ59HGUJZ3QBgqlmAg,r43DrfYAbAgifsYyNkljZw,Sometimes the bands they book here suck. It can be hit or miss anymore.,2018-01-14 04:12:22,0
60770,zbZyQQOnXd5mx1WvbRvN6A,_E0WPHfJEYmwOUCAj-Jq1A,The Steakhouse at Western Village has Prime Rib that rivals The House of Prime Rib in San Francisco.  Fabulous,2011-01-14 02:17:13,0
60774,640-XJULtQ_P073RMClgPg,UYxGgnJ4Z2lOehK23HSIlw,Great car wash with free coffee & popcorn... Clean bathrooms & waiting area.,2012-06-03 17:29:07,0
60896,RVLIIWzrsmZEGSU08feSQA,JUlsvVAvZvGHWFfkKm0nlg,Margaritas!,2011-03-20 21:34:32,0
60899,qjfMBIZpQT9DDtw_BWCopQ,nIxepiPUk5FUfL4u9EFfew,"Per email received through Creative Loafing Tampa: free mojo roasted pork tonight, Wed. Feb. 1st while it lasts!",2017-02-01 19:54:33,0
60916,xc1opNkFCnAjsPXs7jqtfg,K8b2MQ5Az59-nzvqUfjJEQ,"OMG!!!  Great restaurant, and Judy (wife of Sous Chef) is one of the best FOH staff in Philly.",2012-08-24 02:54:35,0
60931,EZYxgOLy08JIxT6axW_jfA,CVt2-nlsxOz5NSdM35NSkA,Great tasting lunch boxes. We came here and ordered different lunch boxes; all were very tasty.,2015-09-11 18:56:24,0
60937,JyhaN5Y8ILX1n9FsSNRUnA,S2Ho8yLxhKAa26pBAm6rxA,"Good food, loud atmosphere, great service by Ben.",2016-03-17 02:03:10,0
61074,juigu8XxwzLAeikeBzULbg,2myVMP_l-9f9JIZewm19Cg,Finally I can kick up my feet,2011-06-24 04:33:41,0
61099,WB63hQwr_iamlKx25BP1Fw,LVteL0Rnh2E_yOFCLJUPhg,"This place always hits the spot. 
Excellent inside outs, delicious cheesesteaks and awesome hoagies. I like this place because they use high quality ingredients and the food is consistently good.",2013-09-17 00:17:10,0
61168,8vFkEtbAhhDC38SgJt1C-A,nIxepiPUk5FUfL4u9EFfew,Beer and pizza,2013-02-23 23:50:22,0
61265,wfvtOrGyJbYS61qjaHcJng,2myVMP_l-9f9JIZewm19Cg,Quaint and charming,2012-07-04 20:50:59,0
61291,RMxvK_J_Pn3qWUxug8-8zw,GMjmrbksSxabPHYmhjsOEw,Can you imagine freaking George Zimmerman was up in this place today. it's unfortunate that they wouldnt let us use a pic of zimmerman as  a live damn target. I can bet that anybody using that target will shoot it right through the head.,2014-03-10 21:33:41,0
61371,t7Ob9kGm-S26vfrx9nDaGw,dIpTuL2T1L98GQGU17IeSw,Portabelly sandwich was a delicious vegetarian option. I also like the atmosphere and lounge music.,2012-07-14 18:49:29,0
61380,wlkFYIGQveFMi43VHmXeTQ,hYonVJe6xzVBHHT2FLo4zg,New opening and service can be a bit dodgy. Giving it a try we will see? Our waitress Bailey was super attentive and answered every question we asked and the ones she didn't know she found out. Will have to come back when the soda fountain is worked out.,2014-05-06 22:45:40,0
61420,zmlt7zUWY1Bi58_2n7UopQ,rBE5TT_ndOOczNBrbRnJwA,The dessert cake looks like this... Oh and that's a hookah in the background... Pretty cool.,2013-12-02 02:11:33,0
61425,_p9_GXbJNUJLkieaOFfhHg,4gn3wNWbNK8vPfoCN_BKAA,Management is on point! Employees are amazing !!,2019-05-06 22:32:19,0
61564,I2XpWCHAom1JRyHXZQrnfg,SFafZpcCcjO28VzimGmKrQ,M-F pizza.... buffet $5.99,2019-11-08 17:23:06,0
61587,Wqz69fHHlsQDL2fDpshOeg,A0F-h3xJm_6gHDKcDQwSrQ,You can taste it first before order and you may want to ask for if there's special for today/week/season :),2013-10-31 23:07:30,0
61641,EL3FT8Kf4gAbUhcMGGE3MA,sAl3Paa2co9Kw87UruMYEg,"Bigger suite, very affordable. 
Super convenient.",2012-12-10 08:09:18,0
61684,mY_eMd6HhtqHlxPMcs4qAw,JUlsvVAvZvGHWFfkKm0nlg,"Brunch is good, not expensive and usually no wait",2015-08-01 16:01:00,0
61693,S_zViaP_ErhRODWZazREgA,NIQWO-Q_F598XlAvZnFVCA,Sculpin IPA is a great beer here. Good recommendation by the staff!!,2013-11-25 01:27:38,0
61695,HR5TCqAjP9rlM_n_BA0JfA,fimN43BUUakBXeRUQqkYvA,Love they've expanded the space. Still gets crowded & always hard to park. CWE Problems : ),2015-05-16 22:25:04,0
61705,aRIwtRfgPx4Acdfc_9Uh4w,HQVNu1-m1ZkIlFeYWMv5jg,Dina does great waxing. Request her for eyebrows!,2016-07-26 15:16:48,0
61716,kmGLI-wiHnZr6kT1N0runw,6bpM6wCmdp6qZGTQbiR3-A,You can substitute chicken on any of the burgers to make it feel like a health(ier) alternative.,2013-10-13 21:47:45,0
61723,W2GzRZJ3r-QXEXxC3SEkJg,2g1ZiT6cM1NC4nJ8xS6EGg,Good services great food,2018-06-15 01:11:40,0
61764,CqQEtaHtXGY-sFu6hGuEBA,o2i4AvqF6Q9lWK-wksxzuw,OMG best oysters around!!!!,2012-05-29 17:18:28,0
61820,rL5uMarIYnEMgDr09pafqg,ksmv1lth23zEVNNGppRicg,One of the few places you can still get non-ethanol gasoline and one of the only gas stations in Lakeview.,2011-07-22 19:33:30,0
61837,xrVsLRstDkS471e0Auz85w,JUlsvVAvZvGHWFfkKm0nlg,"Awesome service, great staff and amazing food. My new favorite spot.",2016-10-29 04:46:13,0
61863,RYeY30XyjFQ7B4sITi8iag,O3JyUZS0wzsApHJ1h10Ndg,They have a shelf to store your purse and a radio on top of that!,2013-04-11 21:35:30,0
61935,bRw59TFUEmB2FGjeIzOhNw,NIQWO-Q_F598XlAvZnFVCA,"Great burgers, great beer and whiskey selection!",2017-12-04 23:56:17,0
61955,iY262MNxieewhtFInDY4Rg,QWqKTWQ2OiDgo3dzNkpung,The prices went up by $1 - $3,2016-04-02 20:12:10,0
61984,kymXvuAfT4_ob7BO0Y_lfQ,lsv6tD1R0JqqzyovWThdsQ,Get the lobster bisque and roast beef 1/2 combo.,2012-12-18 19:18:05,0
62024,_p9_GXbJNUJLkieaOFfhHg,4gn3wNWbNK8vPfoCN_BKAA,Located inside the shopping center,2019-05-06 22:31:31,0
62126,jm6zCII7rtT6y04csSUUfw,zELwtjWxnYXVAzOu82Xw1Q,They only serve some coffee after nine. This wawa is horrible. Employees are so rude. Just go to the big wawa on 63.,2018-01-01 19:31:03,0
